"Paper Title","Paper Link","Publication Year","Publication Type","Publication Title","Author Names","DOI","PDF Link","Abstract","Relevant Excerpt"
"South Africa in Global Development Fora: Cooperation and Contestation","https://scispace.com/paper/south-africa-in-global-development-fora-cooperation-and-1ekm2ix26x","2021","Book Chapter","","Elizabeth Sidiropoulos","10.1007/978-3-030-57938-8_19","https://scispace.com/pdf/south-africa-in-global-development-fora-cooperation-and-1ekm2ix26x.pdf","Since 1994, post-apartheid South Africa has embraced its Southern and African identity, with its foreign policy reflecting its aim to engage in international fora to advance Southern principles and the African voice. It also developed instruments to undertake South-South cooperation that focused largely on sharing its own lessons from its political transformation with post-conflict countries. This chapter explores the tensions between cooperation and contestation in South Africa’s involvement in global development and in its own development cooperation. South Africa has worked on global reforms with large emerging powers, but their interests are not always aligned with those of Africa. South Africa and Africa have derived leverage from their numbers and the related legitimacy in selecting what initiatives of more influential actors they will support.","Community (SADC) Regional Investment Policy Framework and the OECD-African Development Bank Group initiative to support business integrity and anti-bribery efforts in Africa. South Africa is also an associate of the BEPS (base erosion and profit-shifting) project. The OECD and the DAC:
 Yet, although South Africa recognises the technical value of its various engagements with the OECD, it has chosen not to join it. The developing countries that have joined it see their admission to the group as a mark of their developmental success. 3 South Africa and other developing countries, such as India, consider the OECD-and especially its Development Assistance Committee (DAC)-as a bastion of Western-created rules that should not be foisted upon developing countries, especially in relation to monitoring, measuring, and evaluating their SSC . The OECD and the DAC:
 In addition, the OECD's role in global economic governance has grown over the years, especially in its interaction and engagement with the G20, which often looks to it for technical support. Because the G20 does not have a formal Secretariat, the OECD partly fills that role in practice, positioning itself as a global policy network with wide-ranging expertise. Although this has proved extremely useful to G20 and other processes, a number of South African officials in the past have raised concerns that the absence of well-resourced institutions from the Global South means that policy advice and input into the G20 process is still shaped by Northern-dominated organisations, notwithstanding the fact that the G20-with its more diverse membership-should differentiate itself from the traditional orthodox global policy prescriptions. The OECD and the DAC:
 Thus, South Africa objects to the dominance of a Northern-constructed and dominated organisation exercising a significant role both in the evolution of global public goods and in the development cooperation field. The OECD and the DAC:
 South Africa is an emerging donor, but it does not report on its development cooperation to the OECD's Development Assistance Committee. Historically, after 1994, South Africa played an important role in the OECD-DAC meetings-and specifically the HLFs, starting with Rome and culminating in Busan in 2011-as a recipient. The OECD and the DAC:
 In its dual role of being both a donor and a recipient, however, it has adopted an approach at the political level emphasising that the metrics created by the traditional aid donors to monitor and evaluate their development cooperation cannot be applied to SSC. South Africa argues that much of SSC is not financial, but technical, in-kind, or a contribution to global public goods (e.g. peace-building) ). The DAC system does not provide for the tracking and evaluation of that kind of cooperation through its focus on monetisation. The OECD and the DAC:
 In 2015, the OECD spearheaded a process to develop a universal standard to track contributions to the SDGs-the Total Official Support for Sustainable Development (TOSSD). A number of developing countries opposed the OECD's engaging in this process. At a political level, the South Africa government prefers the UN's Inter-agency and Expert Group on SDG Indicators, and indeed at the UN in New York, TOSSD is perceived as a product of the DAC. 4 There is concern that TOSSD is another way of camouflaging ODA and reducing it overall."
"Apples and Dragon Fruits: The Determinants of Aid and Other Forms of State Financing from China to Africa","https://scispace.com/paper/apples-and-dragon-fruits-the-determinants-of-aid-and-other-19o7mx8qzj","2018","Journal Article","International Studies Quarterly","Axel Dreher
Andreas Fuchs
Bradley C. Parks
Austin M. Strange
Michael J. Tierney","10.1093/ISQ/SQX052","https://scispace.com/pdf/apples-and-dragon-fruits-the-determinants-of-aid-and-other-19o7mx8qzj.pdf","Chinese “aid” is a lightning rod for criticism. Policymakers, journalists, and public intellectuals claim that Beijing is using its largesse to cement alliances with political leaders, secure access to natural resources, and create exclusive commercial opportunities for Chinese 
firms—all at the expense of citizens living in developing countries. We argue that much of the controversy about Chinese “aid” stems from a failure to distinguish between China’s Official Development Assistance (ODA) and more commercially-oriented sources and types of state financing. Using a new database on China’s official financing commitments to Africa from 2000-2013, we find the allocation of Chinese ODA to be driven primarily by foreign policy considerations, while economic interests better explain the distribution of less concessional flows. These results highlight the need for better measures of an increasingly diverse set of non-Western financial activities.","particular interest to development practitioners and policy-makers, but studies that tackle these questions require highly disaggregated data on the geographical scope and timing of international development project interventions as well as the ability to measure outcomes of interest and at similar spatial and temporal scales. Conclusions:
 The fact that neither international institutions with formal monitoring responsibilities (for example, the OECD-DAC) nor scholars seem to be able to keep pace with the rapid changes in the global development finance regime has far-reaching implications for the amount, diversity, and utility of knowledge that social scientists will be able to generate in the future. We have good reasons to believe that the structural changes in the international development finance market will substantially impact political, social, economic, and environmental outcomes in developing countries and perhaps even reshape the foundations of international order (Woods 2008; Kersting and Kilby 2014; Strange et al.  2017). However, many of the conceptual categories and much of the evidence that we have at our disposal to understand these changes and their consequences are no longer fit for purpose. This note describes a data collection, categorization, and analysis effort that represents one step forward on this front."
"Five things we learned about development finance while building Aid Atlas","https://scispace.com/paper/five-things-we-learned-about-development-finance-while-51huo0jley","2020","","","Aaron Atteridge
Georgia Savvidou","","https://scispace.com/pdf/five-things-we-learned-about-development-finance-while-51huo0jley.pdf","","no picture of how this funding was targeted (without delving deeper into project documents). Germany features again in the top five list of donors who have reported this way. Furthermore, the largest recipient of this Unallocated/ unspecified finance is Developing countries unspecified. Some donors do not disaggregate their data to individual recipients, sectors or policy objectives:
 Similar issues can also be seen in the data for global objectives (these are called ""policy objectives"" in the OECD's CRS). An example is the Inter-American Development Bank, which seems not to indicate any of the global objectives targeted by their financial support other than Gender equality. Some donors do not disaggregate their data to individual recipients, sectors or policy objectives:
 So, some of the data leaves us with more questions than answers. A first step toward answering these would be to look at the individual projects. Some data on project descriptions can be downloaded directly from the profile pages in Aid Atlas. Developing countries, unspecified India China Africa, regional America, regional Asia, regional Morocco:
 Individual countries 'Unspecified' or 'regional' Implementation problems with climate finance?:
 Concerns about how climate finance is working have been raised regularly by recipient countries and research institutions, and one commonly cited problem has been the burdensome processes for accessing and using resources (Amerasinghe et al., 2017;  Dupuy K. et al., 2019; Green Climate Fund, 2019; Lundsgaarde et al., 2018; UNFCCC and  Standing Committee on Finance, 2018). Such criticism has referred particularly to the multilateral climate funds, like the Green Climate Fund, Adaptation Fund, several funds under the Global Environment Facility, and the World Bank's Climate Investment Funds. Implementation problems with climate finance?:
 One way to look for process-related challenges in the data is to compare commitments of finance with disbursement levels over the same period. This gives an indication of whether funding that has been approved (""committed"") is actually being paid out (""disbursed""). A low ratio of disbursements to commitments might indicate, for instance, that there are challenges in executing projects on the ground, or some other problems in the delivery of funding. Implementation problems with climate finance?:
 The data shows clearly that finance for climate change mitigation or adaptation activities has a significantly lower disbursement ratio than the average for all global development finance (see Figure ). In other words, less of the approved funding is being spent. Implementation problems with climate finance?:
 To explore why this might be the case, we looked further at disbursement ratios for individual donors in 2013-17. All the biggest providers of climate finance -France, the European Bank for Reconstruction and Development, EU institutions, the US, Germany, and Japan -have a much higher disbursement ratio for non-climate projects than they do for climate projects. So, the problem does not seem to lie with how e ective they are at disbursing funds in general."
"Apples and Dragon Fruits: The Determinants of Aid and Other Forms of State Financing from China to Africa","https://scispace.com/paper/apples-and-dragon-fruits-the-determinants-of-aid-and-other-3yvequi6dz","2016","Journal Article","Social Science Research Network","Axel Dreher
Andreas Fuchs
Andreas Fuchs
Bradley C. Parks
Austin M. Strange
Michael J. Tierney","10.2139/SSRN.2855935","https://scispace.com/pdf/apples-and-dragon-fruits-the-determinants-of-aid-and-other-3yvequi6dz.pdf","Chinese “aid” is a lightning rod for criticism. Policymakers, journalists, and public intellectuals claim that Beijing is using its largesse to cement alliances with political leaders, secure access to natural resources, and create exclusive commercial opportunities for Chinese firms — all at the expense of citizens living in developing countries. We argue that much of the controversy about Chinese “aid” results from a failure to distinguish between China’s Official Development Assistance (ODA) and more commercially-oriented sources and types of state financing. Using a new database on China’s official financing commitments to Africa from 2000-2013, we find the allocation of Chinese ODA to be driven primarily by foreign policy considerations, while economic interests better explain the distribution of less concessional forms of Chinese official financing. Our results suggest Beijing’s motives may not be substantially different from those shaping the allocation of Western official finance. Our data and findings also address the need for better measures of an increasingly diverse set of non-Western financial activities that are neither well understood nor systematically tracked by the Western-led regime for international development finance.","We do not argue that evidentiary challenges are the only reason that certain donors are maligned in the public sphere. As suggest, many studies of Chinese and other non-Western aid may be guided by motives other than the pursuit of scientific knowledge. Introduction:
 largely comply with a basic set of voluntary reporting norms, many so-called ""emerging"" or ""non-traditional"" donors-including Brazil, India, Iran, Qatar, Venezuela, and China-have opted out of the international regime put in place by Western governments to track development finance activities. Consequently, there is a growing chasm between the de facto suppliers of development finance and the international reporting regime designed to track their activities (see . The methods that we employ in this paper to collect and classify data on Chinese development finance can also be used to identify the activities of other non-Western sources of development finance. To help standardize empirical research on the behaviors and motivations of non-Western development financiers and enable comparisons with Western donors and creditors, we employ OECD-DAC standards that distinguish official development assistance (ODA) from other official flows (OOF). ODA includes transactions that (a) are provided by official agencies to developing countries and to multilateral institutions; (b) primarily aim to promote economic development and welfare; and (c) are concessional in nature-i.e., they have a grant element of at least 25 percent. Introduction:
 OOF are also funded by government agencies but do not qualify as ODA because they are not primarily intended for development in the recipient country or they are not sufficiently concessional. Many non-DAC suppliers of development finance do not comply with these reporting norms. As such, the absence of common definitions and consistent measurements across DAC and non-DAC donors has led many analysts to draw ""apples-to-oranges"" comparisons-or, perhaps more appropriately in the case of China, ""apples-to-dragon fruits"" comparisons . As  show, mismeasurement of Chinese state financing has led researchers to arrive at wildly different estimates of ""Chinese foreign aid,"" making it difficult for researchers and policy makers alike to draw meaningful inferences about the nature and scope of Beijing's development program.  We address this problem by categorizing Chinese state financing flows according to existing OECD-DAC definitions and standards."
"Old Wine in New Bottles? Does Climate Policy Determine Bilateral Development Aid for Renewable Energy and Energy Efficiency?","https://scispace.com/paper/old-wine-in-new-bottles-does-climate-policy-determine-4dfiad8s16","2011","Book Chapter","Revue Internationale de Politique de Développement","Axel Michaelowa
Katharina Michaelowa","10.1007/978-0-230-31401-6_4","https://scispace.com/pdf/old-wine-in-new-bottles-does-climate-policy-determine-4dfiad8s16.pdf","Published by Palgrave Macmillan Since the UN Conference on Environment and Development in Rio de Janeiro in 1992 bilateral and multilateral donors have stressed that development assistance has increasingly been oriented towards climate-friendly interventions. With respect to energy aid, this should lead to a substantial increase in projects related to renewable energy and energy efficiency. Given a new database of hundreds of thousands of bilateral development assistance projects, we can assess whether such a reorientation has indeed taken place. We find that, contrary to expectations, the share of bilaterally-funded renewable energy and energy efficiency projects did not increase over the period from 1980 to 2008. This share fluctuated greatly, following the price of oil, peaking with the second oil crisis of the early 1980s. The impacts of global climate policy treaties are minor or inexistent. ‘Traditional’ renewable energies such as hydro and geothermal declined, while “new” renewables showed two peaks in the early 1980s and late 1990s. Differences between donor countries are huge. Several countries, including climate sceptics such as the US and Australia, but also the UK and Switzerland, saw a consistent decline. The self-proclaimed climate pioneers such as Germany, the Netherlands, Norway and Sweden show peaks related to both the oil crises and international climate policy. Only in Austria, Denmark, Finland and Spain can ‘new’ climate mitigation development assistance be found.","climate aid has shifted the priorities of development cooperation away from the central objective of poverty reduction. On the other hand, there is the accusation that despite all promises too little aid has been channelled into activities in support of the Rio Convention on Climate Change. Introduction:
 Due to the scarcity of reliable data, neither of the two arguments has been seriously tested so far. However, a new project-level aid (PLAID) database, available to the public since March 2010, now provides a much better source of information on the development of aid activities -including individual projects, but also programme support, budget support and so on -in this field .  Based on individual project descriptions, we code over 750,000 bilateral aid activities of 21 Organisation for Economic Co-operation and Development (OECD) Development Assistance Committee (DAC) donors with respect to their relevance for specific types of energy efficiency and renewable energy. We exclude multilateral aid , covered about 15 per cent of the total climate change-related aid flows) because the decision making of multilateral donors such as the World Bank is likely to depend on parameters that are different from the decision making of individual governments . On this basis we address the following questions: Introduction:
 • Has there been a real change in development activities towards a greater emphasis on renewable energy and energy efficiency? Introduction:
 • And if so, what are the major drivers of this effect? Has the change come about as a consequence of the international treaties on climate policy or, more generally, of a stronger environmental consciousness in donor countries? Or is it primarily related to traditional factors such as industrial lobbies and energy prices driving decisions in development policy, and therefore unrelated to public opinion or green political ideology? Is there any interaction with the CDM which targets projects in developing countries? Introduction:
 In Chapter 2 we develop the conceptual framework of this analysis based on the idea that the relevance of renewable energy and energy efficiency projects could be driven either by the same traditional factors as ever ('old wine', business as usual) or by the effect of international climate policy agreements since Rio, and by environmental preferences of donor country citizens and governments. In Chapter 3 we describe the new PLAID database, our coding procedure for bilateral aid related to renewable energy and energy efficiency, and the additional political-economic variables to be considered. Chapter 4 provides an initial empirical assessment based on descriptive statistics. Chapter 5 finally brings all arguments together in an econometric analysis and Chapter 6 concludes."
