"Paper Title","Paper Link","Publication Year","Publication Type","Publication Title","Author Names","DOI","PDF Link","Abstract","Relevant Excerpt"
"This study w as requested by the European Parliament's Subcommittee on Human Rights.","https://scispace.com/paper/this-study-w-as-requested-by-the-european-parliament-s-1p0a7jqvlg","2012","","","Christel Cournil
Anne-Sophie Tabau
Despina Sinou
Sandrine Maljean-Dubois
Chloé Vlassopoulos
Isabell Verdier-Büschel","","https://scispace.com/pdf/this-study-w-as-requested-by-the-european-parliament-s-1p0a7jqvlg.pdf","","commitments and actions, the agreements mandated advances in the reporting and review of the climate finance contributions (MRV) of countries. There is, however, one problem, namely that there is no clear and agreed definition of ""new and additional"" finance. Monitoring and transparency:
 States are yet to spell out what is meant by ""new and additional"", or specify whether eligible projects will need to have climate action as a principal, or only a significant, objective (UNFCCC, 2010, para. 41, § § 6162, § 112). In addition, the EC committed to ensuring transparency through the provision of a biannual progress report on the implementation of the EU's faststart funding commitment, with a first report published for the Bonn UNFCCC session in June 2010 (EC, COM(2010)86 final). Monitoring and transparency:
 For now, while existing reporting channels such as UNFCCC National Communications, the OECD's Rio markers, the efforts of bilateral and multilateral development banks, and the EU's Faststart Finance report, attempt to address some of these challenges, they have not been systematically implemented. For example, while public finance can be traced through the OECD's DAC and Rio Markers, private finance is more difficult to track down. The international community has to explicitly define which private flows will be included and how they will be accounted for and monitored. Since reporting does not cover all Parties or all flow types, it does not capture everything that might be considered as ""climate finance"". The coverage of finance sources and the time frames and guidelines of reporting also differ considerably. Moreover, there are huge overlaps between the various reporting channels, thus increasing the risk of double counting when information from different reporting channels is brought together (AEA, 2011). It will take several years to develop the process and bring it up to a sufficient standard. Conclusions:
 The mainstreaming of human rights and climate change crosscutting issues in European external cooperation policy is calling into question the development of the EU's ""actorness"" (Vogler, J.). The challenge of adaptation to climate change has inspired the EU in the formulation of a genuinely ambitious policy. It is a challenging process, which is still in a consolidation phase. For now, the EU has articulated a clear policy intention towards the integration of climate change concerns. But the EU has not yet integrated the human rights dimension. Moreover, there is (so far) a discrepancy between the EU's policy intentions and their implementation in practice (Gupta, J. & Van der Grijp N., 2010). Beyond which, the EU's role is evolving: ""TheEU'sfunctionasadistributorofdevelopmentassistanceisdiminishing inimportance,whileitsregulatoryroleasPolicysetterisbecomingmoresignificant"" (Orbie, J., & Versluys, H., p. 88). Nevertheless, it could have a substantial guiding influence on other countries. 8.6.1:
 Step up efforts to mobilize public and private finance"
"WHO Regional Office for Europe.","https://scispace.com/paper/who-regional-office-for-europe-1m6s3vi6hx","1993","Journal Article","The Lancet","Mark Tsechkovski","10.1016/0140-6736(93)91122-3","","","Title: List of Abbreviations CFD Critical Factors for Decision-making CIDA Canadian International Development Agency DAC Development Assistance Committee (of the OECD) DAH Development Assistance for Authors: Michaela Pfeiffer,Marco Martuzzi,Julia Nowacki"
"The Alignment of the Economic Institutions on Climate Finance","https://scispace.com/paper/the-alignment-of-the-economic-institutions-on-climate-423urb5f30","2021","Book Chapter","","Jakob Skovgaard","10.1017/9781108688048.014","https://scispace.com/pdf/the-alignment-of-the-economic-institutions-on-climate-423urb5f30.pdf","","states than the output of the IMF. Thus, economisation has been more ideal-typical or 'pure' in the case of the IMF, and less 'contaminated' with member state preferences (as discussed in Section 13.2). Incentives:
 The institutions have provided very few direct changes to the incentive structures to the actors involved in climate finance, be they contributors, recipients or a third kind of actor. The incentives provided by the institutions have not been in conflict at any point, and have to some degree been synergistic. The OECD DAC's monitoring of bilateral (and recently also multilateral) climate aid, incentivises countries to provide more climate finance (but also to designate more of their development finance as climate-related), as well as to prioritise vulnerable countries and adaptation. Such incentives may consist of reputational costs associated with not living up to climate finance commitments, which reduce the credibility of the states and developed countries as a group when future commitments (regarding climate finance or other issues) are negotiated. Yet, the absence of individual country climate finance targets limits the impact of such reputational costs. The 2009 G20 attempt to create a shared climate finance commitment for industrialised countries would have constituted an important change to incentive structures (in terms of developed G20 countries facing reputational costs if the commitment were not fulfilled), yet did not succeed. It was only influential in an indirect way through influencing the UNFCCC's Fifteenth Conference of the Parties (COP15) climate finance commitment, most notably the USD 100 billion target, which the developed countries may suffer reputational costs if they do not meet. The IMF's recent attention to climate measures in its interaction with individual countries via socalled Climate Change Policy Assessments and in the future also Article IV consultations) may affect the incentives of both contributors and recipients of climate finance, for example, by tying IMF finance to the Assessments or by contributor countries providing more finance to countries with positive Assessments. At the time of writing, five countries (Belize, Grenada, Micronesia, St Lucia and the Seychelles) have been the subjects of such Assessments."
"Marrying new global players with the international aid transparency initiative: the future of aid data governance 1","https://scispace.com/paper/marrying-new-global-players-with-the-international-aid-511vwxjjhk","2011","","","Pranay Sinha
Michael Hubbard","","https://scispace.com/pdf/marrying-new-global-players-with-the-international-aid-511vwxjjhk.pdf","Development aid forms an important link between rich countries, poor countries and poor people. But there have been serious concerns raised by aid critiques about the quality and accuracy of the global aid data (Riddell 2007, Easterly and Pfutze 2008 and Birdsall et al, 2010). It is often incomplete and of poor quality. Though OECD DAC has long played a key role in defining and capturing data on development finance and monitoring its global standards for DAC donors (OECD, 2011), question arises as whether its existing standards or categorization are inclusive enough to integrate the new global players or not? Given the growth in the number of players in development finance and when the new global players are continuously increasing their respective aid financing, it becomes apparent that their exclusion will prohibit getting a full picture of the future global aid governance. There are ongoing efforts like International Aid Transparency Initiative (IATI) to improve aid data transparency and reform the way aid data is disclosed by established players as well as new global players. The lack of aid data availability of the new players in existing global aid governance is difficulty attributed to their data capture, methodology and different data categorisations. So against this backdrop, the paper aims to explore the relationship between established players and new global players as they both grapple with rival definitions of aid quality. Whether the newly established transparency standards of aid data provide any way forward to the future of aid data governance where all new players will adhere to IATI standards. The paper will investigate the incentives and disincentives for the new global players to adhere to IATI standards and in the wake of any binding standards (IATI or OECD), what challenges and opportunities they bring to the future of aid data governance. And how does the existence of IATI standards shape the dynamics of rising power under South-South Development Cooperation? Recent initiatives like AidData have attempted to build upon the existing OECD database and included other new players like India, South Africa and Brazil in their comprehensive development finance database but unable to do so for China. As the IATI has finalized a standard which all the established players having signed the IATI leaving behind a few major players like USA and Japan, the larger issue remains as how IATI as new ‘governance through standards’ tool would bring rising powers on board to adhere to its data standards and improve the overall governance of aid. What would be the norms, authority and legitimacy of involving emerging donors with this proposed aid data governance through standardization (IATI)? Drawing on current research into the categorisations of aid data by new donors, the paper discusses options for bringing in new donors into the IATI standard, including south-south cooperation in forming acceptable standards. The future of aid data governance very much depends upon if and how the new global players marry with the International Aid","repayment ) generated by export credits (Sinha and Hubbard, 2011 forthcoming). The principle takes the form of transparency over the terms of conditions of all export credits and disclosure of relevant project information both from DAC and Non DAC donors (ibid). Institutional Affiliation:
 While DAC donors are primarily affiliated to OECD as members, non DAC donors are not affiliated to any collective institution like OECD DAC. In a recently organised workshop on Asian approaches to development cooperation it was observed that there exists a complex aid architecture where bodies like OECD/ DAC, G20, UNDCF and South-South Cooperation Forums represent different development paradigms and Asian donors 'struggle to identify which, if any, body aligns with their interests' . Some non DAC donors argue that the current global aid architecture is 'exclusive to DAC donor discourse', 'unequal as the donor vs. recipient dichotomy accentuates the power discrepancy amongst nations' and 'limited as it does not include large-scale economic infrastructure projects' (ibid:4) 6. Aid Effectiveness Framework  argues that DAC donors adhere to an aid effectiveness framework like the Paris Declaration because they have 'evolved it as an instrument for effectiveness' whereas Non DAC donors do not adhere to the same as they were not involved during the negotiations; therefore they are 'out of the purview of any such global arrangement'. ) also acknowledged that there is a 'perceived legitimacy gap and lack of ownership of the Paris Declaration agenda on the part of non DAC donors'. Though a consensus was reached between the Working party on Aid Effectiveness and non DAC donors in 2007 that the 'declaration principles are about improving the effectiveness and quality of aid' how much ownership it has brought on part of the Non DAC donors is questionable (ibid,9). Many of the aid instruments of Non DAC donors are similar to those of DAC donors except export credits; therefore an important area for Non DAC donors to explore is the implications of adhering to Paris declaration principles for export credit as a modality. As DAC donors do not include their export credit as ODA, it is worth watching how this will unfold post Busan forum."
"Coding and tracking adaptation finance: lessons and opportunities for monitoring adaptation finance across international and national scales","https://scispace.com/paper/coding-and-tracking-adaptation-finance-lessons-and-3xb4vkd6xo","2012","","","Lindsey Jones
Tom Mitchell
Paula Silva Villaneuva
Sarah Standley","","https://scispace.com/pdf/coding-and-tracking-adaptation-finance-lessons-and-3xb4vkd6xo.pdf","","above would be captured under existing coding procedures. Thus, any system wishing to realistically track and code the spectrum of investments that contribute to adaptation (whether explicitly recognised or not) must have measures to incorporate this within their methodology, to some extent at least. i) Coding and tracking across the full spectrum of adaptation activities:
 Reasons for this discrepancy are numerous, including the practical difficulties in assigning adaptation co-benefits to the myriad of existing development activities. Much can be attributed to factors of political economy. There is pressure, largely from international donors, to demonstrate additionality and promote the use of tracking systems that separate and distinguish between development and adaptation. They also discourage the documentation of already existing development activities in light of their contributions to adaptive capacity, seen by many as 'repackaging' of ODA . i) Coding and tracking across the full spectrum of adaptation activities:
 If by the World Bank's own definition, the purpose of tracking adaptation finance is to 'track aid flows that support climate action' (World Bank 2012b), then doing so only through projects that explicitly identify adaptation as an operational focus is misguided. Efforts to build on the Rio Markers, to include co-benefits and add further granularity, are a positive step forward. However, they themselves need to go further and include the significant contributions of wider development interventions on adaptation in 'support of climate action'. i) Coding and tracking across the full spectrum of adaptation activities:
 ii) Transparency, Replicability and Accountability i) Coding and tracking across the full spectrum of adaptation activities:
 The move toward robust and transparent reporting of adaptation finance will face significant methodological hurdles (such as those outlined in Section 3). Overcoming many of these difficulties is likely to be achieved only if contributor and recipient actors report in a routine, comprehensive and comparable manner, according to common definitions and standards. Doing so is critical to the collection of complete, reliable and timely data. This is not to say that all tracking procedures must be conducted through a singular approach or system. Rather, innovation and diversity will be key to the collective improvement of tracking systems, and different types of tools and methodologies will be needed to satisfy user needs. These needs are diverse, and can include: ensuring transparency of financial flows; tracking public financial commitments; verifying progress towards commitments and actions; and assessing effectiveness of respective financial mechanisms, or the effectiveness of adaptation spending. Greater transparency of methodological applications of tracking is needed in order to ensure replicability and accountability across scales and systems (and more importantly, understand the reasons behind their use and selection). i) Coding and tracking across the full spectrum of adaptation activities:
 Learning and reflection are key to this dialogue. Although efforts to track and code adaptation are in their relative infancy, important lessons can already be drawn. For example, a review of the Rio Markers for adaptation would present a useful opportunity for deliberation and revision of the markers' utility across levels. Lessons can also be learned from the small number of approaches that have adapted and expanded with the methodologies used by the OECD (such as EC and CPEIR processes). i) Coding and tracking across the full spectrum of adaptation activities:
 Seeking to build on the important experience of ODA coding procedures will be of great relevance, given the similarities in many of the key obstacles. Shared reflection, alongside greater emphasis and use of political economy analyses (PEA), is imperative if innovative tracking tools are to be successfully trialled, evaluated and eventually scaled up in practice."
"Informações Financeiras sobre os Riscos Relacionados ao Clima: Uma Revisão Sistemática","https://scispace.com/paper/informacoes-financeiras-sobre-os-riscos-relacionados-ao-5knuf5j2","2023","Journal Article","Reunir","André Luis Rossoni
Renata Luiza de Castilho Rossoni","10.18696/reunir.v13i2.1520","https://scispace.com/pdf/informacoes-financeiras-sobre-os-riscos-relacionados-ao-5knuf5j2.pdf","A pesquisa tem como objetivo mapear a literatura sobre a divulgação de informações financeiras relacionadas aos riscos climáticos. Para isso, realizou-se uma revisão sistemática da literatura apoiada na análise bibliométrica. Foram analisados 55 artigos, coletados das bases de dados Web of Science e Scopus. Este artigo contribui com a análise sistematizada de um tema que está cada vez mais presente na rotina das organizações e tem sido o foco das discussões a partir do Acordo de Paris de 2015. O estudo revelou que a disseminação do conhecimento sobre o tema é recente, mas evidencia importantes achados, como a falta de padronização dos indicadores e mecanismos robustos de acompanhamento de desempenho ambiental organizacional, destacando a importância de novos estudos. A transparência nas informações disponibilizadas também é um tema relevante no campo de discussão para o aperfeiçoamento dos métodos, assim como a falta de regulamentação para a obrigatoriedade de divulgações financeiras sobre os riscos climáticos. Lacunas de pesquisa foram evidenciadas, sendo divididas em indicadores, gestão de riscos, qualidade das informações, ativismo dos investidores e regulamentação. Cinco temas principais emergiram da revisão com ênfase aos estudos relacionados ao alinhamento das organizações às orientações da TCFD. Proposições foram sugeridas em cada um dos temas discutidos. A investigação constatou que houve um progresso relacionado a transparência na divulgação dos dados das empresas, porém apenas isso está muito longe de ser um resposta adequada aos desafios para o alinhamento das finanças relacionadas ao clima.","abordem as leis e os normativos, tanto das instituições governamentais responsáveis pela regulação dos mercados financeiros, como das instituições contábeis, responsáveis pela estrutura dos relatórios corporativos. Considerações finais e temas para pesquisas futuras:
 A Tabela 3 reúne os artigos classificados conforme a categorização apresentada, onde se sugere os temas de pesquisa:   Qualidade das informações: como a verificação externa em relatórios de sustentabilidade é combinada com a verificação em relatórios TCFD? Ligação entre a qualidade das divulgações climáticas e o desempenho financeiro; qualidade das informações ambientais em termos de relevância, comparando a comunicação ambiental com as práticas de investimento das empresas.  Ativismo dos investidores: análise das escolhas de investimento e interações dos investidores no sistema financeiro; envolvimento da comunidade de investidores imobiliários na tomada de decisões governamentais e regulatórias; entender as expectativas dos investidores sobre a velocidade e a forma dos padrões de descarbonização e como eles afetam as decisões de investimento.  Regulamentação: Para os formuladores de políticas e instituições regulatórias, seria relevante acompanhar as ações ao longo do tempo e identificar os desafios de tomar medidas além da medição; Saber se a adoção e as melhorias relacionados aos relatórios de sustentabilidade acontecem voluntariamente ou por meio de regulamentação; Desenvolver ainda mais a estrutura de contabilidade ambiental complementando a estrutura com recomendações oferecidas no Relatório da TCFD; resposta regulatória financeira global à mudança climática e o desenvolvimento e implementação ideal de regimes corporativos de divulgação relacionados ao  clima (MCDRs); análises mais profundas das possíveis ferramentas e políticas que podem ser ativadas além dos bancos centrais, como em outras partes do governo (ministérios de finanças, política industrial e outras instituições financeiras públicas). Fonte: Elaboração própria (2022). Considerações finais e temas para pesquisas futuras:
 O conteúdo dos artigos selecionados evidencia a existência de lacunas que necessitam de discussões urgentes, especialmente se considerarmos os impactos globais das mudanças climáticas. Empresas que construírem indicadores que comuniquem de forma transparente suas ações para controle e mitigação dos riscos climáticos estabelecerão uma comunicação mais clara com os stakeholders. Estratégias de comunicação podem ser elaboradas para atender a demanda de investidores ativistas, para dar segurança ao mercado e a reputação da empresa ao longo do tempo."
"Desarrollo y carácter normativo de la Contabilidad Ambiental en el Ecuador","https://scispace.com/paper/desarrollo-y-caracter-normativo-de-la-contabilidad-ambiental-apekaec3qq","2017","","","Pablo Domingo Vilela Mera","","https://scispace.com/pdf/desarrollo-y-caracter-normativo-de-la-contabilidad-ambiental-apekaec3qq.pdf","The environmental accounting, a part of the accounting, allows to register and reveal economical-financial information of the companies activities impacting in the nature with their production activities and, until now, it has not obtained a big development because of the lack of commitment showed by the businessmen, who does not want to reveal these abnormalities due to it represents great amounts of money. The accounting standards that are currently applied do not indicate regulatory provisions to register and reveal the environmental effects that are caused. The results 1 Magister en Contabilidad y Auditoría, Magister en Educación: Mención en Desarrollo del Currículo, Profesor Principal en la Universidad Técnica de Esmeraldas “Luis Vargas Torres”, Ecuador. Email: pd_vilela@hotmail.com Forma sugerida de citar: Vilela Mera, Pablo Domingo. (2017). Desarrollo y carácter normativo de la Contabilidad Ambiental en el Ecuador. Retos de la Ciencia, 1(2), pp. 180-191. Pablo Domingo Vilela Mera Desarrollo y carácter normativo de la Contabilidad Ambiental en el Ecuador 181 of accounting are important for the calculation of financial and eco-efficiency indicators, to facilitate decision making in companies, for the impacts that are caused to the environment and nature. For the theoretical sources consulted, in Ecuadorian companies this accounting is not done, but it is made environmental accounting, since some years ago, through the Ministry of the Environment of Ecuador (MAE), so the objective of this research is to analyze the development and updating of environmental financial accounting in Ecuador, which allows having accurate and reliable economicfinancial information for the decision-making of mitigation and remediation of the impacts over nature of the production processes of these companies.","Contabilidad,Auditoría,Educación : Mención En Desarrollo,Del Currículo Keywords: desarrollo, normas de contabilidad, contabilidad ambiental, empresas, impactos ambientales development, accounting standards, environmental accounting, companies, environmental effects INTRODUCCIÓN:
 La Conferencia de las Naciones Unidas sobre Cambio Climático (COP 23), celebrada en Bonn, Alemania del 6 al 17 de noviembre 2017, concluyó con la aprobación de un acuerdo en el que los países se comprometen a evaluar sus emisiones de CO2 en el año 2018. Este evento tuvo como objetivo comprobar que los compromisos acordados en el Acuerdo de París 2015, estén operando de acuerdo con la meta de mantener el aumento de temperaturas del planeta por debajo de los 2 grados. INTRODUCCIÓN:
 En esta cumbre el problema del financiamiento retrasó el diálogo, porque los países en desarrollo exigían a los más desarrollados que proporcionaran las cifras de sus aportes con dos años de antelación, para conocer previamente los fondos con los que se contaría, debido a que el posible retiro del acuerdo de Estados Unidos, creó un clima de incertidumbre, ya que éste es uno de los mayores donantes; razón por la cual, en los próximos meses se realizarán reuniones en las que se determinarán los mecanismos para la implementación del Acuerdo de París, que se aprobarán en la 24 Conferencia de Polonia en diciembre de 2018.  Frecuentemente los fenómenos climáticos han representado amenazas para la seguridad de las naciones, especialmente en el aspecto ambiental, lo que ha provocado desequilibrios económicos y sociales, entonces preservar el ambiente ha sido un tema global de mucha importancia en los últimos tiempos. En consecuencia, el desarrollo económico que se intenta lograr, será con mejores estándares de sostenibilidad, lo que ha permitido tomar acciones para conocer los costos de producción de la explotación de los recursos naturales, así como de los impacto de estas actividades para la mitigación y remediación que corresponde de acuerdo a la ley."
