"Paper Title","Paper Link","Publication Year","Publication Type","Publication Title","Author Names","DOI","PDF Link","Abstract","Relevant Excerpt"
"Financing needs to achieve Nationally Determined Contributions under the Paris Agreement in Caribbean Small Island Developing States","https://scispace.com/paper/financing-needs-to-achieve-nationally-determined-fsh1bq9t","2023","Journal Article","Mitigation and Adaptation Strategies for Global Change","Preeya Mohan","10.1007/s11027-023-10062-9","https://scispace.com/pdf/financing-needs-to-achieve-nationally-determined-fsh1bq9t.pdf","Caribbean Small Island Developing States (SIDS) are highly vulnerable to the impacts of climate change. Given high mitigation and adaptation costs and constrained domestic finances, they seek international funding to meet their climate objectives. This paper investigates Caribbean SIDS perspectives on the role of international climate finance in addressing climate change and its effectiveness in meeting climate goals. The paper first explored the climate financing needs of sixteen Caribbean SIDS through a content analysis of their Nationally Determined Contributions (NDCs). It then compares the climate finance needs of the region with international climate finance commitments received by examining climate finance trends using data from the Organization for Economic Cooperation and Development (OECD) Development Assistance Committee’s (DAC) Creditor Reporting System (CRS). The study revealed large gaps in estimating the climate finance needs of the region, as well as important patterns in the way climate finance is being distributed across mitigation, adaptation and overlap activity; principal versus significant climate objective; recipient country; sector; and source and type of funding. These findings are useful to help countries make decisions about how international climate finance should be used, and how its impacts should be evaluated and a basis for climate finance negotiations and dialogue with bilateral development partners and multilateral climate funds, and to assess whether available funds are being put to good use and identify problems that need to be addressed. ","comparisons. More importantly, there is no guidance on the role of finance and cost estimates when countries prepare their NDCs . Methodology and data: Despite this, the NDCs are the most comprehensive and comparable climate development plans countries produce. Methodology and data:
 The trend analysis then evaluated submitted NDC financing needs for mitigation and adaptation against committed mitigation and adaptation finance from the OECD DAC CRS. This involved the identification of trends based on mitigation, adaptation and overlap activity; principal (when the climate objective is explicitly stated as fundamental in the design of or the motivation for the activity) versus significant (when the climate objective is explicitly stated but it is not the fundamental driver or motivation for undertaking the activity) financing; recipient country; sector; and source and type of funding. While the OECD DAC CRS requires donors to indicate whether the funds target one of the four Rio Markers-mitigation, adaptation, biodiversity and/or desertification (OECD 2014)the system has limitations which can affect the reliability of the data . It mainly captures bilateral financing from OECD DAC members and, to a lesser extent, multilateral funds. Non-OECD DAC members may therefore be excluded as well as some multilateral financing. Also, the data comprise commitment data and not disbursement data. The data are also self-reported and reporting standards are likely to vary across countries. Furthermore, not all development assistance programs are screened to determine whether they include a climate focus. There may therefore be flows targeting climate activities that are not captured. Despite these limitations, the Rio Markers System is the most advanced system to monitor, report and verify international climate finance across countries. Costing NDC mitigation and adaptation targets:
 Caribbean SIDS set out ambitious mitigation and adaptation targets in their NDCs which require significant finance to move from aspiration to implementation. As seen in Table , all countries except Cuba and St. Lucia stated that the type of mitigation coverage was economy-wide. Countries nevertheless identified key sectors, namely energy; agriculture; transport; waste; land use, land use change and forestry (LULUCF); and industry. The target year for implementation and the investment period was mainly 2030, although some countries have listed 2025 (Guyana and St. Vincent and the Grenadines), while others have more than one target year such as Barbados, St. Kitts and Nevis, Suriname (2025 and 2030) and Dominica ."
"Sustainability assessment of the public interventions supported by the ReSTART project in the CITI4GREEN framework","https://scispace.com/paper/sustainability-assessment-of-the-public-interventions-30wvmlmc","2022","Journal Article","Social Science Research Network","Laura Cavalli
Mia Alibegovic
David A. Vaccari
Andrea Spasiano
Fernando Nardi","10.2139/ssrn.4186738","https://scispace.com/pdf/sustainability-assessment-of-the-public-interventions-30wvmlmc.pdf","","Introduction:
 In the last decade, data-driven decision-making has been praised as the point of convergence between management and scientific research by both public and private institutions. However, in many areas, data integration is still in the early stages. The sustainability field advocates for quantitative approaches to assess future developments and propose a course of action. When data is lacking, the only possible solutions are mixed qualitative-quantitative models. Introduction:
 After briefly discussing existing methods for sustainability assessment, the paper proceeds by applying Cavalli Evaluation methods for sustainability assessment can have a wide-ranging approach, or they can be applied to specific works or policies. By the nature of this research, the authors have looked for an assessment method that could go to a granular level to evaluate the sustainability impacts of a single public work, such as the construction of a single building. At the same time, the authors have aimed at scaling up and summarizing the results and linking them to the Sustainable Development Goals (SDGs). Introduction:
 Methods that track SDGs achievement exist. However, most of them focus on a macro level. The Sustainable Development Report  publishes the 2030 Agenda's targets' yearly achievements worldwide or national level. Similarly, the SDGs tracker , by the Global Change Data Lab, in partnership with Our World in Data, uses data from the latter to update data visualizations keeping a record of SDGs' achievements at a national level.  analyzed the literature for ""criteria for the assessment of the sustainability of public constructions."" They identified the four most-cited sustainability assessment tools, mainly used by the private sector at the time (they are still present): BREEAM, LEED (Leadership in Energy and Environmental Design), SBtool (Sustainable Building Tool), and Green Star. However, these tools are expensive, and the details of the evaluation process are kept behind closed doors, requiring a leap of faith by the final user. Perlingeiro et al. (2019):
 Therefore, outputs of heterogeneous inputs are impossible to compare. Perlingeiro et al. (2019):
 In short, sustainability assessments use SDGs for macro estimates while specific evaluations are left to other tools, mostly private. Perlingeiro et al. (2019):
 Since 1998, the Development Assistance Committee (DAC) of the Organization for Economic Co-operation and Development (OECD) has set up the Rio markers system , consisting of markers to monitor and statistically report on the development finance flows targeting the themes of the 1992 Rio Conventions. From the early 2010s, the European Commission started using Rio markers to measure its environment and climaterelevant spending (EC, 2014)  and provide statistical reports. The original Rio markers have three possible scores indicating whether the Rio Convention themes are (0) not targeted, (1) a significant objective, or (2) a principal objective of the action. The EU has decided to use 0%, 40%, and 100%, respectively.  In 2014, Moro et al.  went one step further to develop a strategic environmental assessment methodology."
"Tracking finance flows towards assessing their consistency with climate objectives","https://scispace.com/paper/tracking-finance-flows-towards-assessing-their-consistency-11bjiut7ua","2019","Report Series","Research Papers in Economics","Raphaël Jachnik
Mariana Mirabile
Alexander Dobrinevski","10.1787/82CC3A4C-EN","https://scispace.com/pdf/tracking-finance-flows-towards-assessing-their-consistency-11bjiut7ua.pdf","Achieving a low-greenhouse gas (GHG) development requires making finance flows consistent with this objective. In order to measure progress to date as well as inform future public action in this area, this paper calls for further efforts to track gross primary investments flows in new infrastructure and equipment and the refurbishment of such assets, as well underlying sources of finance. The proposed scope focuses on tangible fixed assets with a direct and significant impact on GHG emissions.","Unclassified capture international and national (domestic) as well as public and private finance. In practice, due to UNFCCC context as well as the availability of data sources, it has a strong focus on finance flows from developed to developing countries. Tracking Article 2.1c-related and climate finance: differences and common challenges:
 In contrast, as highlighted in Figure .1, measuring progress towards Article 2.1c requires looking at the consistency of all finance flows with climate objectives, including finance for activities that undermine or do not impact climate objectives. As such, the scope of tracking finance in relation to Article 2.1c goes beyond the current scope of the Biennial Assessment.  ). Tracking Article 2.1c-related and climate finance: differences and common challenges:
 This paper does not aim at proposing a criteria for activities' classification, but rather focuses on the availability of the information to which any criteria for classification could be eventually applied. The paper suggests a scope of tracking to observe investments made in the past, which can then be labelled as contributing, undermining or not impacting climate objectives based on e.g. available classifications of activities, forward-looking national mitigation objectives and strategies, as well as sector-specific emission and transition pathways at national and international levels. Tracking Article 2.1c-related and climate finance: differences and common challenges:
 To this end, finance flows need to be tracked at the highest possible level of disaggregation. Some systems provide a classification of activities such the International Standard Industrial Classification of All Economic Activities (ISIC), and are designed to compile economic data. As such, they allow to present data at the level of subsectors e.g. coal and solar within the electricity sector, road and rail within the transport sector. Some other systems provide a classification of products (and services) such as the European Union's statistical classification of products (CPA). They are designed to categorise products that have common characteristics and allow to collect statistics on the production, distribution, international trade and consumption of such products. Tracking finance flows: proposed scope:
 The term ""finance flows"" referred to in the Article 2.1c of the Paris Agreement is all encompassing and may include any economic transaction. Figure .1 plots four metrics relating to the financial markets and the economy: stocks of financial assets and of tangible fixed assets on the one hand, gross domestic product (GDP) and gross fixed capital formation (GFCF) on the other hand. Tracking finance flows: proposed scope:
 Financial markets are often cited as a source for financing the transition to a low-GHG and climate-resilient development. More specifically, assets under management by institutional investors are regularly quoted to illustrate that the issue is not a lack of available capital, but rather a lack of projects with attractive-enough risk-return profiles. Stocks of tangible fixed assets are several times smaller than stocks of financial assets, with growing divergence between the two. Loosely speaking, this illustrates the financialisation of the economy, i.e. a significant amount of financial intermediation activity linked, on average, to each tangible fixed asset. In addition, the valuation of financial assets is influenced by secondary markets and their supply and demand dynamics."
"Mobilising private adaptation finance: developed country perspectives","https://scispace.com/paper/mobilising-private-adaptation-finance-developed-country-3g6ixqw4s8","2017","Journal Article","International Environmental Agreements-politics Law and Economics","W. Pieter Pauw
W. Pieter Pauw
W. Pieter Pauw","10.1007/S10784-016-9342-9","https://scispace.com/pdf/mobilising-private-adaptation-finance-developed-country-3g6ixqw4s8.pdf","The private sector is one of the sources of finance included in developed countries’ pledge in the UN climate negotiations to mobilise $100 billion annually by 2020 to support developing countries’ efforts to address climate change. For adaptation in particular, it remains unclear what mobilised private finance is. Research so far has focused on its potential and experiences in developing countries, but not on the arguments of those who introduced and continue to advocate private adaptation finance: developed countries. This paper investigates the positions of developed countries and development banks and agencies. In particular, it aims to identify whether those actors can reach a common understanding of private adaptation finance that minimises norm conflicts in a fragmented climate finance system. Empirically, the paper examines the Biennial Reports and submissions on Strategies and Approaches for Mobilising Scaled-up Finance of six developed country parties, as well as data from interviews with experts from development banks and agencies. The analysis finds a number of discrepancies between these sets of actors, for example on motivations for and modes of private sector involvement. This discrepancy is the result of ambiguity around the concept of private adaptation finance in a highly fragmented climate finance architecture. This ambiguity is problematic when the aim of mobilising private adaptation finance is to contribute to the $100 billion commitment. However, if the aim is adaptation in practice, both ambiguity and fragmentation might actually make the climate finance system more inclusive and innovative.","(BR1: 1), this should be recognised, ''rather than seeking overly simplified solutions focused on a particular delivery channel, sector, or financing approach''. At the same time, however, the USA only describes three financial instruments in their submissions (see Table ). Tracking private adaptation finance:
 All respondents' organisations report their climate finance contributions using the OECD-DAC Rio Markers. Although these markers were originally introduced by the OECD-DAC to indicate donor's environmental policy objectives in development cooperation , they are also used to measure climate finance. Some respondents state that their organisations also monitor and report because of internal targets on financing (for instance renewable energy or climate, twice); because they want to demonstrate that the organisation is an important player in climate finance (twice); or because of accountability towards taxpayers (once). Tracking private adaptation finance:
 However, only four respondents mention that their organisation reports on mobilised private adaptation finance, emphasising how difficult this is. The respondents provide three reasons for this: first, internal lack of preparedness. One organisation undertook a reporting exercise before the UN Climate Summit in New York in 2014. According to the respondent, this exercise clarified that there is currently no information available on mobilised private adaptation finance. Future monitoring and reporting would require a new system to be built up; second, limited willingness from the private sector to undertake MRV. Apart from an administrative burden, two respondents also mention confidentiality and competitiveness as potential issues for the private sector. Third, three respondents mention that without a clear definition of adaptation finance, MRV will be difficult and perhaps not very useful. For example, two respondents state that their institution covers the incremental costs of adaptation. Similarly, one development bank covered the costs to climate-proof a road. Strictly speaking, the private sector's share (the road itself) is not invested in adaptation. In another example, three respondents highlight that the MDBs currently use different methods in their common reporting system. This system (see EIB 2014) takes vulnerability reduction as a starting point rather than adaptation, which could result in an overestimate of mobilised adaptation finance. Reporting based on different methods cannot provide final answers in terms of contributions to the $100 billion commitment. Tracking private adaptation finance:
 In terms of the climate finance system, the most conflictive consequences of fragmentation identified in this paper relate to the accounting of mobilised private finance towards the $100 billion commitment. Such accounting would require a cooperative (if not synergistic) actor constellation. However, respondents see limited willingness from the private sector to be part of MRV in the climate finance system. Furthermore, respondents use different reporting systems themselves. Finally, developed countries disagree on the importance and aim of tracking mobilised private finance. Discussion and conclusion:
 This paper analyses the position of developed countries as well as development banks and agencies towards private adaptation finance. It shows that there is a discrepancy between the former's position in submissions to the UN climate negotiations, and the latter's understanding and local implementation of private adaptation and adaptation finance (see Table ). This paper shows that this discrepancy is a consequence of the fragmented climate finance system."
"Climate justice through climate finance? Australia’s approach to climate finance in the Pacific","https://scispace.com/paper/climate-justice-through-climate-finance-australias-approach-2667us1f","2023","Posted Content","","","10.21203/rs.3.rs-2533601/v1","https://scispace.com/pdf/climate-justice-through-climate-finance-australias-approach-2667us1f.pdf","Abstract Pacific Island actors have long called for climate justice in the international climate regime, particularly in the form of financial support. While climate finance can be conceptualised as a mechanism of climate justice, the extent to which climate finance does indeed contribute to climate justice is contested. We explore these contestations by looking at Australia’s development programme in the Pacific between 2010 and 2019, examining both policy documents and climate finance flows to the Pacific. This analysis is conducted through a climate justice lens that we conceptualise as consisting of three dimensions: adequacy, additionality and predictability; balance between adaptation and mitigation and priority provision of adaptation finance to vulnerable recipients; and, donor coordination. Our analysis shows that Australian public climate finance has not acted as a mechanism of climate justice in the period studied, even if does meet some criteria of climate justice. From a justice perspective, Australia has approached climate change inconsistently and at times incoherently across its development program in Pacific Island countries. These results provide important lessons for Australia’s approach going forward, under a new government and a new development policy framework. ","models, according to relative capacity, responsibility, or comparative advantage in development programming. We here have chosen a demonstrative example we consider relevant to the just provision of climate finance in the Pacific: the collective provision of principal adaptation finance to PICs. In 2010, Australia's core policy notably mentioned that the increase in donors and climate finance, especially for adaptation, after Copenhagen could represent a 'key risk to the quality and value of regional activities' through 'proliferation and fragmentation'. However, as Figure demonstrates, any prospective attempts to address this challenge have not translated into growing -or even consistent -receipt of principal adaption finance for PICs from the DAC as a collective. Conclusion:
 To what extent can Australia's climate and development finance in the Pacific be considered a mechanism for climate justice? We argued that for climate finance to contribute to climate justice, it needs to (i) be adequate, additional, and predictable, as well as (ii) prioritise adaptation for vulnerable recipients, mainly through grants. We also expect (iii) donors to provide their fair share towards the collective goal, and coordinate finance flows. We evaluated Australia's climate and development programme in the Pacific through these criteria, relying on both its policy discourse and climate finance flows. Conclusion:
 We found that Australia's climate finance has not been additional over time. Certainly, it was provided in grant form (as was the vast majority of Australia's ODF) -fulfilling the international commitment to do so for adaptation. However, while CODF during the initial AusAID policy period (2010-2013) was additional to existing development finance, in the long Australia's climate finance was also not consistently predictable. It maintained its Pacific CODF flows, though this provision was variable over time amongst recipients, with latter-year growth principally explained by significant finance and disbursements to Papua New Guinea. Conclusion:
 In addition, while Australia prepared several multi-year investment plans for the Pacific, discursive patterns showed that these plans were not a good predictor of the CODF PICs could expect to be disbursed. This kind of discursive inconsistency is reflective of the same found in core policies, and of the clear disruption that the 2014 governance/policy/institutional shift appears to have provoked for not only the programme overall, but for the situation of climate change within it, suggesting that climate finance predictability may be impacted by donor political shifts or governance modalities."
