"Paper Title","Paper Link","Publication Year","Publication Type","Publication Title","Author Names","DOI","PDF Link","Abstract","Relevant Excerpt"
"Postface: fragmentation, failing trust and enduring tensions over what counts as climate finance","https://scispace.com/paper/postface-fragmentation-failing-trust-and-enduring-tensions-15fqg1896o","2017","Journal Article","International Environmental Agreements-politics Law and Economics","J. Timmons Roberts
Romain Weikmans","10.1007/S10784-016-9347-4","https://scispace.com/pdf/postface-fragmentation-failing-trust-and-enduring-tensions-15fqg1896o.pdf","The Paris Agreement commits nations in Article 2(1) to “Making finance flows consistent with a pathway towards low greenhouse gas emissions and climate-resilient development.” However there is an absence of internationally agreed accounting rules that would permit overall assessments of progress to this goal and any meaningful comparisons of performance between countries. This is true also for the quantitative Copenhagen/Cancun promise by developed nations to jointly mobilize US$100 billion by 2020. Our goal is to provoke discussion about the depth of the problems this lack of a functional definition and accounting system have created and perpetuated. We do so by describing the fragmented system of national reporting of climate finance and how the OECD’s Rio Marker system is serving neither contributors nor recipients. More than a trust issue between developed and developing countries, we argue that the lack of modalities to account for climate finance also considerably impedes the effective functioning of the bottom-up approach that now prevails under the UNFCCC. The deadline to propose ""modalities of accounting climate finance"" by 2018 is a crucial window in which to address this chronic issue in international climate policy.","established for other forms of foreign aid (OECD 2015; Climate Policy Initiative 2015; see special issue Editorial). The governance of this financing is largely decentralized and poorly coordinated (UNFCCC Standing Committee on Climate Finance 2014). A bottom-up approach to climate finance:
 Some argue that the bottom-up approach prevalent in development assistance brings flexibility and innovation and that such an approach fits well with the many motivations for providing aid, and with the diverse willingness and capabilities to contribute to development finance efforts (e.g., . On the other hand, one could argue that a bottom-up approach to climate finance is probably associated with lower aggregate flows of climate finance (e.g., . This is a critical problem for those observers who consider climate finance as a tool for international justice or even as a kind of compensation for the disproportionate responsibility of some countries for climate change (see, e.g., . The fragmented approach creates serious problems of coordination and duplication of donors' efforts ). Transparency on climate finance has been identified by some observers as a key to overcome those shortcomings . We agree with Hall (this issue) that the current setup is one of ''strategic and epistemic ambiguity'' (see also Pauw, this issue). Current decisions regarding climate finance reporting and accounting under the UNFCCC pose significant barriers to achieving climate finance transparency through comprehensive accounting; we examine these decisions in the next section. Accounting for climate finance: a nationally driven approach pushed to its limits:
 For many years, developed countries have committed to reporting climate finance provided to developing countries to the UNFCCC Secretariat (e.g., UNFCCC 1999: Decision 4/CP.5; UNFCCC 2011: Decision 2/CP.17; UNFCCC 2012: Decision 19/CP.18). Negotiators decided on current climate finance reporting guidelines for Annex II Parties in 2011 in Durban and in 2012 in Doha. Compared to previous reporting guidelines under the UNFCCC, the comprehensiveness and transparency of current reporting requirements have improved (see ). Accounting for climate finance: a nationally driven approach pushed to its limits:
 However, most developed countries have so far failed to ensure transparency and completeness in their reporting to the Secretariat (UNFCCC Standing Committee on Finance 2014; AdaptationWatch 2015). While each Party can be shamed individually for failing to provide transparency in its own reporting to the Convention, we argue that the current general lack of transparency around climate finance is also a collective failure. Indeed, despite progress on reporting guidelines, current decisions under the UNFCCC still fall far short of a robust accounting framework for climate finance. By failing to define what counts as climate finance (activities, financial flows, etc.) and who is responsible for counting it, negotiators have left the door wide open to contrasting statements on the fulfilment of these promises."
"Monitoring and Tracking Long-Term Finance to Support Climate Action","https://scispace.com/paper/monitoring-and-tracking-long-term-finance-to-support-climate-4dshy36wee","2011","Report Series","","Barbara Buchner
Jessica Brown
Jan Corfee-Morlot","10.1787/5K44ZCQBBJ42-EN","https://scispace.com/pdf/monitoring-and-tracking-long-term-finance-to-support-climate-4dshy36wee.pdf","The Cancun Agreements formalise a collective commitment by developed countries to provide new and additional funding for action on climate change in developing countries both in the short- and longer-term. This collective financial commitment requires a system to measure, report and verify (MRV) the relevant financial flows across a variety of sources. However, the existing effort to track climate finance lacks transparency, comparability and comprehensiveness. The paper highlights the relevant information that needs to be tracked in order to build a comprehensive MRV system for climate finance, proposing both improvements to current reporting and tracking systems as well as new reporting approaches for a more robust and inclusive MRV system. The paper suggests tracking information along a multi-dimensional structure. This structure is aspirational, to be achieved and added to over time. Certain elements of it might not be feasible in the near term but could be developed with a targeted effort. For example, while not a priority in the near-term it is important to recognise the growing importance of South-South financial flows to support climate action and to anticipate adding reporting on this in future. Of course such a system must also be built up slowly, allowing reporting countries to build capacity to provide higher quality and more complete information over time. In particular, the paper outlines two strawman proposals for reporting on climate finance that integrate existing and new UNFCCC vehicles for reporting or recording information, (i.e. national communications and biennial reports, the registry) as well as drawing on other reporting systems. These are: (i) reporting through limited sources; or (ii) reporting through expanded sources, building on broader institutional collaboration and non-party reporting. Both ‘strawman’ proposals foresee an important oversight role from the UNFCCC to serve as recipient of all data, and to co-ordinate the verification and review and/or international consultation and analysis process. Both options advance a more comprehensive system for storing and accessing data on international climate finance and will facilitate comparison and integration of data across sources.","reports on global trends in sustainable energy investment, giving an overview of capital flows and an analysis of the trends in sustainable energy investment activity. The underlying database allows access to information on specific technologies and sectors as well as on larger regions and is publicly available. Outstanding issues for current reporting:
 Overall, data availability and quality on climate finance flows is growing and this has become a much more significant and robust field of interest and activity in recent years. The previous section details the significant strengths as well as weaknesses associated with information and reporting systems covering the various financial flows and corresponding reporting systems, and proposes ways to improve information for each. Significant gaps in data remain, which often reflect weaknesses in the methodological approaches to quantify climate finance as well as lack of statistical systems to track how and what share of flows support climate change action. Any framework for MRV of climate finance requires attention to the gaps and weaknesses embedded in existing systems and data sets and an approach to weave the various sources of information together for a more comprehensive assessment. Table  below provides a summary of the quality and availability of existing climate finance data.   Climate finance, measured as annual commitments of funds or capital flows (disbursements of public funds or private investment) that support climate action as well as cumulative amounts of investment or public fund capital over time. Measurements should be in a common currency and real year monetary units (e.g. real USD for the most recent year).  Climate-related finance across the different sources and types, to be measured in the same way as climate finance.  Leveraging ratios of public international climate finance. This is important given the recognition in the Cancún Agreements that long-term climate finance can come from a range of sources, including private sources. A standard definition of leveraging ratio is needed and is proposed here to be: the incremental private investment over the aggregate international public finance flow (concessional and non-concessional). Outstanding issues for current reporting:
 The system should be designed to accommodate accounting for climate finance flows of different origin or source country and in different directions (North-South, South-South, South-North or even North-North or domestic flows), however, in the spirit of the Cancun Agreements, a first priority is a comprehensive picture of the international (N-S flows). Outstanding issues for current reporting:
 Capital flows should include both concessional and non-concessional flows of public funds as well as climate finance from the private sector (which by definition is non-concessional). As the value of these flows differs with respect to how they ""support"" action in developing countries, it is advisable to collect data so that concessional public flows can be analysed separately from private flows e.g. for the purposes of understanding the leveraging effects of public support. Public flows of concessional and nonconcessional finance can be aggregated for the purpose of comparing levels of support by donor or donor institution (e.g. MDBs) however such aggregations should also be handled with care, delineating also the two separate categories of flows."
"Reporting on capacity-building and technology support under the Paris Agreement: Issues and options for guidance","https://scispace.com/paper/reporting-on-capacity-building-and-technology-support-under-2iagrmadg1","2018","Report Series","","Justine Garrett
Sara Moarif","10.1787/F5330A47-EN","https://scispace.com/pdf/reporting-on-capacity-building-and-technology-support-under-2iagrmadg1.pdf","The enhanced transparency framework for climate action and support envisaged by the Paris Agreement is to “build on and enhance” current transparency arrangements under the United Nations Framework Convention on Climate Change (UNFCCC). This paper draws lessons from current reporting by Annex I and non-Annex I countries both within and outside the UNFCCC reporting framework to provide options that might inform the development of modalities, procedures and guidelines (MPGs) for reporting of technology transfer and capacity-building support under the Paris Agreement. The paper offers six options for consideration by Parties, with an emphasis on reporting by developing country Parties, given that very limited guidance has been available to these Parties to date. The options include how Parties might provide more guidance for reporting separately on financial, technology and capacity-building support; frame reporting of support needs and support received in the context of nationally determined contributions (NDCs); and facilitate more consistent use of key terminology and clearer reporting.","developed country Parties to report, rather than Annex II countries only. ""Other Parties"" that provide support (i.e. countries that are not ""developed"", but that may provide support to other developing countries) are also invited to provide information. │ 17:
 Parties • There will likely be limitations on the information that can be reported under the Paris Agreement's transparency framework, particularly for the purposes of informing the global stocktake. This is due to governments' partial view of technology development and transfer activity, and lack of visibility on the use of multilateral funds to which they may contribute. 8 Parties that report to the OECD DAC use the Rio marker system, which advises on ""marking"" official government flows to developing countries that are relevant for climate change. Many of these Parties use the information reported to the DAC as a basis for reporting to the UNFCCC. For Parties that do not report to the DAC (including voluntarily), a system to help identify climaterelevant support flows may be helpful, and could be reported on transparently. How Parties use the DAC marking systems for UNFCCC reporting does vary, and work is currently underway to improve transparency between Rio marker data and reporting to the UNFCCC. One proposal is to include additional columns in the reporting system to allow reports to indicate on a voluntary basis whether individual activities are included in reports to the UNFCCC, whether this is done at the commitment or disbursement level, and how much  ). │ 17:
 The UNFCCC is also currently exploring ways that links could be created between climate finance reporting to the Convention and to other processes more broadly: see for example https://unfccc.int/files/cooperation_and_support/financial_mechanism/standing_committee/applica tion/pdf/draft_bn_on_mrv_scf14_2709.pdf. Learning from current experience in reporting: technology and capacitybuilding support received and needed:
 The mandate of building on and enhancing current transparency arrangements under the Convention (Art. 13.3) also applies to information on support received, currently reported in both national communications (NCs) and biennial update reports (BURs). Guidance has been generic and inconsistent, and most non-Annex I Parties to date have less experience than Annex I Parties with reporting support-related information. This section examines what practices could be ""built on"" from current reporting under the UNFCCC, along with other related processes that may impact or facilitate the reporting of this information. The section ends with the implications that both sets of experience may have for understanding how reporting could be ""enhanced"" in the future."
"Tracking Climate Finance","https://scispace.com/paper/tracking-climate-finance-3y28xkcklr","2012","Report Series","Research Papers in Economics","Christa Clapp
Jane Ellis
Julia Benn
Jan Corfee-Morlot","10.1787/5K44XWTK9TVK-EN","https://scispace.com/pdf/tracking-climate-finance-3y28xkcklr.pdf","Developed countries have committed under the international negotiations to jointly mobilising USD 100 billion per year by 2020 for climate change mitigation and adaptation in developing countries. Yet consistent and comprehensive data to track this commitment are currently lacking. Such data will also help governments and the private sector understand how much and what type of climate finance is flowing today, so as to be able to evaluate progress and effectiveness of international climate finance flows. Estimates based on available data are highly uncertain and incomplete, highlighting several challenges in establishing a robust tracking system. A more political question is what should be the internationally agreed definition of ""climate finance"" or, absent agreement on that, what types of flows or activities might count towards the USD 100 billion? On the more technical side, challenges include clearly defining flows and sources of international climate finance, determining the cause and effect of flows, and establishing the boundaries of finance flowing towards climate change action. This paper considers what data are currently available to track climate finance, and demonstrates the complex nature of financial flows through examples across international and domestic as well as public and private flows. The examples highlight questions on how to count and track climate finance.","on clean energy only. The data set does not provide a way to identify the geographic origin of the capital flows, thus makes it difficult to use for N-S tracking or to attribute flows to a donor country. It is also a commercial database, accessible only on a fee basis. Private philanthropy $0.4 bn ** (including voluntary carbonmarket flows ) Gates, Rockefeller and Soros, etc.  OECD DAC system has begun to track data on a voluntary basis with philanthropic donors e.g. Gates foundation is reporting through the system.  Annual reports are also available (but data is not routinely aggregated across different foundations). 9:
 Recent OECD analysis proposes a way forward to define a range that frames ""green FDI"", providing proxies for the lower and upper bounds of this range using narrow and broad definitions of ""green FDI"" (see . However it is unclear whether FDI statisticians would place a priority on improvement required to systematically track ""green FDI."" Further, FDI outflows from China, India and other non-Annex I countries are significant , hence it is important to consider eventual expansion of any tracking system to cover developing-developing (and even developing-developed) FDI. While tracking Developing-Developing flows is not of direct importance to counting the $100 bn, it would be useful to explore in future. What we do not know: Illustrated by financial flow examples:
 The fundamental challenges for robust tracking lie at the nexus of political and technical issues. On the political side, there are many open questions regarding what financial flows could count towards the $100 billion. These political questions are intertwined with complex data issues, related to availability and levels of disaggregation (both geographical and sectoral) 10 . Some general principles of climate finance had been proposed during the on-going climate negotiations e.g. predictable, adequate and scaled-up (UNFCCC 2011). However the application of such principles becomes complicated when considering examples of entangled financial flows across a variety of financial actors and instruments, and they were subsequently omitted from the Durban outcome (UNFCCC 2011a)."
"Mainstreaming Adaptation in National Development Planning","https://scispace.com/paper/mainstreaming-adaptation-in-national-development-planning-2wfysbn7ow","2016","Report Series","Research Papers in Economics","Juan Casado-Asensio
Anna Drutschinin
Jan Corfee-Morlot
Gisela Campillo","10.1787/5JLSV0689QS6-EN","https://scispace.com/pdf/mainstreaming-adaptation-in-national-development-planning-2wfysbn7ow.pdf","This Working Paper explores progress in the integration or mainstreaming of adaptation and related objectives into national development planning. It first provides an overview of the international mechanisms, including finance, to support the mainstreaming of climate change adaptation into development planning and policies in developing countries. Through a review of relevant planning documents in fifteen developing countries, it then examines key features in adaptation planning and mainstreaming of adaptation into development planning. These countries were because they have been amongst the highest recipients of adaptation-related bilateral development finance. The research provides a snapshot of current practice. Despite heightened international efforts to support developing countries, evidence of mainstreaming adaptation was only found in a few of the countries and in a few of the sectors studied here. It also found that where mainstreaming is occurring, linkages exist with other policy objectives including poverty reduction, promoting biodiversity and ecosystems, and urban and rural development. The findings may be a useful starting point to guide policy-relevant research, such as to what extent mainstreaming may be occurring on the ground (or not) and how well this progress is reflected in planning documents, as well as how to improve the effectiveness of development co-operation targeting adaptation. The paper may also help inform international efforts under the UNFCCC that are designed to support developing countries to mainstream adaptation priorities into development planning and policy.","objectives. It also shows that providers are recognising adaptation co-benefits of activities primarily targeting other environmental and climate-related objectives, such as mitigation (45% of adaptation activities also target mitigation), biodiversity (35%) and desertification (16%). 31.:
 The integration of adaptation into broader development co-operation activities is important given that the World Bank estimated that up to 40% of ODA is sensitive to climate risks . For example, energy-related interventions can benefit from integrating adaptation considerations. Incorporating a solar photovoltaic (PV) system into an energy project can, for instance, increase resilience to climate extremes such as storms, droughts or high temperatures, as solar PV can continue to operate under these conditions while conventional power sources and their transmission to end-users are negatively affected (e.g. hydropower dams that depend on rainfall; thermal power stations that require water for cooling; above-ground power transmission systems that are exposed to storm damage). Box 3. The Development Assistance Committee Creditor Reporting System and the Rio markers:
 Developed countries signing the three Rio Conventions on Climate Change, Biological Diversity and Desertification in 1992 committed to assist developing countries in the implementation of these Conventions through the provision of finance among other forms of support. The DAC monitors development finance targeting the global environmental objectives of the Rio Conventions through its Creditor Reporting System (CRS) using the ""Rio markers."" The markers are designed to track the integration of environmental objectives into development co-operation portfolios rather than specific quantitative financial commitments and thus the Rio marker data provide a range for adaptationrelated bilateral development finance. The sum of ODA targeting adaptation as a principal objective and ODA targeting adaptation as a significant objective can be considered as the ""upper bound"", while ODA targeting adaptation as a principal objective can be considered as the ""lower bound."" Box 3. The Development Assistance Committee Creditor Reporting System and the Rio markers:
 The Rio marker for adaptation was introduced in 2010. It is applied to activities that intend to reduce the vulnerability of human or natural systems to the current and expected impacts of climate change, including climate variability, by maintaining or increasing resilience, through increased ability to adapt to, or absorb, climate change stresses, shocks and variability and/or by helping reduce exposure to them. This encompasses a range of activities from information and knowledge generation, to capacity development, planning and the implementation of climate change adaptation actions . By way of background, the CRS contains details of over 4 000 climate adaptation-related ODA activities per year since 2010, reaching over 5 400 in 2014."
