"Paper Title","Paper Link","Publication Year","Publication Type","Publication Title","Author Names","DOI","PDF Link","Abstract","TL;DR"
"Transparency in climate finance after Paris: Towards a more effective climate governance framework","https://scispace.com/paper/transparency-in-climate-finance-after-paris-towards-a-more-1or7nd6b9f","2018","Book Chapter","","Felicity Deane
Evan Hamman","10.1007/978-981-13-2155-9_3","","The Paris Agreement charts a new course for measuring, reporting, verification (MRV) of State obligations with the intensification of the emphasis on the criterion of transparency. This is, in part, responsive to modern debates in regards to environmental law generally and climate law in particular. Transparency is crucial to the success or failure of climate mitigation and adaption regimes because climate governance is intimately connected to the ideals of deliberative democracy, public participation, and the rule of law. The Paris Agreement thus presents a ground-breaking and important point in time for both developed and developing States. Aligned with this requirement is the desire to increase the amount and flow of ‘climate finance’ from developed to developing states. The associated need for transparency in funding flows has been raised in part through the accusations of misused or inadequate funds, ‘tied’ funding and double counting. Though there are new informational requirements placed on states in the Paris Agreement, they also present considerable practical challenges. The purpose of this chapter is to analyse the principle of transparency in climate finance and to chart the direction of the associated informational requirements in light of the measures agreed at Paris.","The Paris Agreement charts a new course for measuring, reporting, verification (MRV) of State obligations with the intensification of the emphasis on the criterion of transparency as mentioned in this paper, which is crucial to the success or failure of climate mitigation and adaptation regimes because climate governance is intimately connected to the ideals of deliberative democracy, public participation, and the rule of law."
"Establishing a measurement, reporting, and verification system for climate finance in post-Paris agreement period","https://scispace.com/paper/establishing-a-measurement-reporting-and-verification-system-o8op26hinq","2016","Journal Article","Chinese journal of population, resources and environment","Yinshuo Xu
Ziyuan Dong
Yao Wang","10.1080/10042857.2016.1258802","","The measurement, reporting, and verification (MRV) of climate finance was originated from discussions under the United Nations Framework Convention on Climate Change (UNFCCC). It has been one of th...","The measurement, reporting, and verification (MRV) of climate finance was originated from discussions under the United Nations Framework Convention on Climate Change (UNFCCC) and has been one of the most widely used metrics for climate finance."
"Finanças Climáticas Contabilidade, Sustentabilidade e Títulos Verdes","https://scispace.com/paper/financas-climaticas-contabilidade-sustentabilidade-e-titulos-c3ibs5v2rcyb","2025","Journal Article","Deleted Journal","Ticiane Lima dos Santos","10.23925/cintec.v3i1.72960","","A crescente pressão global por práticas sustentáveis impulsionou a necessidade de transparência e padronização nas informações ambientais, sociais e de governança (ESG). Nesse contexto, a criação do International Sustainability Standards Board (ISSB) e a subsequente publicação das normas de Requisitos Gerais para Divulgação de Informações Financeiras Relacionadas à Sustentabilidade (IFRS S1) e Divulgações Relacionadas ao Clima (IFRS S2) representam um avanço significativo. O Brasil destaca-se por sua atuação pioneira na adoção dessas normas internacionais, evidenciada pela Resolução CVM n.º193 e pela Resolução CFC n.º 1.710, que estabelecem a obrigatoriedade das divulgações a partir de 2026. Tal iniciativa posiciona o país na vanguarda da regulamentação global de relatórios de sustentabilidade. Paralelamente, este artigo aborda o papel crucial dos títulos verdes como mecanismos de financiamento para projetos com impacto ambiental positivo, como infraestrutura hídrica. São apontados desafios relativos à transparência e eficácia desses instrumentos, ressaltando a indispensabilidade da Contabilidade verde para a mensuração e a verificação independentemente dos resultados. A integração da sustentabilidade nas práticas contábeis com o fomento a pesquisas colaborativas internacionais, é apresentada neste momento como fundamental para o desenvolvimento de uma economia mais resiliente e equitativa. ","This study examines the adoption of International Sustainability Standards Board (ISSB) norms in Brazil, highlighting the country's pioneering role in climate finance and sustainability reporting, and the crucial role of green bonds in financing environmentally positive projects."
"Monitoring and Tracking Long-Term Finance to Support Climate Action","https://scispace.com/paper/monitoring-and-tracking-long-term-finance-to-support-climate-4dshy36wee","2011","Report Series","","Barbara Buchner
Jessica Brown
Jan Corfee-Morlot","10.1787/5K44ZCQBBJ42-EN","https://scispace.com/pdf/monitoring-and-tracking-long-term-finance-to-support-climate-4dshy36wee.pdf","The Cancun Agreements formalise a collective commitment by developed countries to provide new and additional funding for action on climate change in developing countries both in the short- and longer-term. This collective financial commitment requires a system to measure, report and verify (MRV) the relevant financial flows across a variety of sources. However, the existing effort to track climate finance lacks transparency, comparability and comprehensiveness. The paper highlights the relevant information that needs to be tracked in order to build a comprehensive MRV system for climate finance, proposing both improvements to current reporting and tracking systems as well as new reporting approaches for a more robust and inclusive MRV system. The paper suggests tracking information along a multi-dimensional structure. This structure is aspirational, to be achieved and added to over time. Certain elements of it might not be feasible in the near term but could be developed with a targeted effort. For example, while not a priority in the near-term it is important to recognise the growing importance of South-South financial flows to support climate action and to anticipate adding reporting on this in future. Of course such a system must also be built up slowly, allowing reporting countries to build capacity to provide higher quality and more complete information over time. In particular, the paper outlines two strawman proposals for reporting on climate finance that integrate existing and new UNFCCC vehicles for reporting or recording information, (i.e. national communications and biennial reports, the registry) as well as drawing on other reporting systems. These are: (i) reporting through limited sources; or (ii) reporting through expanded sources, building on broader institutional collaboration and non-party reporting. Both ‘strawman’ proposals foresee an important oversight role from the UNFCCC to serve as recipient of all data, and to co-ordinate the verification and review and/or international consultation and analysis process. Both options advance a more comprehensive system for storing and accessing data on international climate finance and will facilitate comparison and integration of data across sources.","The Cancun Agreements formalise a collective commitment by developed countries to provide new and additional funding for action on climate change in developing countries both in the short and longer-term as discussed by the authors."
"Financing Climate Change Mitigation: Towards a Framework for Measurement, Reporting and Verification","https://scispace.com/paper/financing-climate-change-mitigation-towards-a-framework-for-3mveu1kfih","2009","Posted Content","Research Papers in Economics","Jan Corfee-Morlot
Bruno Guay
Kate Larsen","","","The current monitoring, reporting and review framework under the UN Framework Convention on Climate Change (UNFCCC) has a number of strengths and weaknesses Weaknesses include inconsistent and/or incomplete self reporting of financial support; infrequent reporting; limited and incomplete information on multilateral development banks and other non-UNFCCC funds; lack of primary data on financial flows under KP mechanisms (CDM); and lack of verification procedures This paper aims to facilitate a discussion about a possible framework to measure, report and verify (MRV) mitigation support It considers the main pathways through which mitigation support to developing countries may flow as well as the availability and suitability of information in this area to provide a basis to measure, report and verify mitigation support A strengthened framework for reporting could be developed and layered into the existing system, eg via National Communications Data gaps and reporting frequency could be corrected through improvements in National Communication guidelines and the development of a common reporting format The UNFCCC could also collaborate with other institutions to develop and draw on more standardised data from other sources and to assure that information across sources is comparable and publicly available A key aspect would be to provide a monitoring system that covers not just public but also private finance in mitigation specific as well as mitigation relevant areas The absence of verification procedures in the current UNFCCC monitoring and review system for mitigation support should also be addressed The Convention does not lay out specific guidelines for the review of mitigation support reported in National Communications and reported information is not formally cross checked with alternative information sources Parties could agree to the elaboration of guidelines for review and verification to help determine whether Parties have employed agreed methods for self assessment and reporting on technology transfer, capacity building and financing, and whether reporting is conducted in a transparent manner In addition, standardised reporting by recipient countries about funds received, use and usefulness of funds could also be an important addition to provide information for verification with information on contributions to mitigation support Le dispositif actuel de surveillance, de notification et d'examen mis en oeuvre en vertu de la Conventioncadre des Nations Unies sur les changements climatiques (CCNUCC) presente des atouts et des faiblesses Parmi les faiblesses, citons les autodeclarations de soutien financier incoherentes et/ou incompletes, les rapports peu frequents, les informations limitees et incompletes sur les banques multilaterales de developpement et les autres fonds geres en dehors de la CCNUCC, l’insuffisance des donnees primaires sur les flux financiers relevant des mecanismes du protocole de Kyoto (MDP) et l'absence de procedures de verification Ce document vise a faciliter le debat sur un eventuel cadre de mesure, de notification et de verification (MNV) du soutien a l’attenuation Il examine les principaux canaux par lesquels peut circuler ce soutien apporte aux pays en developpement au titre de l'attenuation, ainsi que les informations dont on dispose dans ce domaine et leur validite, afin d'etablir des bases pour mesurer, declarer et verifier le soutien a l’attenuation Un cadre renforce de notification pourrait etre cree et s’imbriquer dans le dispositif existant, notamment en mettant a profit les communications nationales Des ameliorations des directives pour l'etablissement des communications nationales et un cadre commun de notification permettraient de remedier aux lacunes dans les donnees et aux problemes de frequence des rapports La CCNUCC pourrait par ailleurs collaborer avec d’autres institutions pour produire et exploiter des donnees plus normalisees en provenance d’autres sources ainsi que pour assurer la comparabilite des informations des differentes sources et le libre acces a ces donnees A cet egard, il serait essentiel de prevoir un systeme de suivi des financements publics, mais aussi prives, qui relevent strictement de l’attenuation ainsi que de domaines connexes Il faudrait aussi remedier au fait que le dispositif actuel de suivi et d’examen du soutien a l’attenuation mis en oeuvre en vertu de la CCNUCC ne comporte pas de procedures de verification La Convention n'enonce pas de directives visant particulierement l’examen du soutien declare au titre de l’attenuation dans les communications nationales, et les informations communiquees ne sont pas recoupees en bonne et due forme avec celles emanant d’autres sources Les Parties pourraient convenir d’elaborer des directives pour l’examen et la verification qui permettraient plus aisement de savoir si les Parties appliquent les methodes convenues pour evaluer elles-memes et declarer les transferts de technologie, le renforcement des capacites et les financements, et si les declarations sont realisees de facon transparente De plus, la notification uniformisee des fonds recus, de leur utilisation et de leur utilite, faite par les pays beneficiaires, pourrait procurer des informations complementaires importantes pour verifier celles concernant les apports de soutien a l'attenuation","In this article, the main pathways through which mitigation support to developing countries may flow as well as the availability and suitability of information in this area to provide a basis to measure, report and verify mitigation support is discussed."
"measurement, reporting and verification (MRV)","https://scispace.com/paper/measurement-reporting-and-verification-mrv-2z68hq87e7","2012","","","R. Quentin Grafton
Harry W. Nelson
N. Ross Lambie
Paul R. Wyrwoll","","","Measurement: “The process of data collection over time, providing basic datasets, including associated accuracy and precision, for the range of relevant variables. Possible data sources are field measurements, field observations, detection through remote sensing and interviews.” Reporting: “The process of formal reporting of assessment results to the UNFCCC, according to predetermined formats and according to established standards, especially the Intergovernmental Panel on Climate Change (IPCC) Guidelines and GPG [Good Practice Guidance].” Verification: “The process of formal verification of reports, for example, the established approach to verify national communications and national inventory reports to the UNFCCC.”","In this article, the authors describe the process of data collection over time, providing basic datasets, including associated accuracy and precision, for the range of relevant variables, for which possible data sources are field measurements, field observations, detection through remote sensing and interviews."
"Green Finance and Accounting: Accounting and Reporting of Environmentally Friendly Financial Products","https://scispace.com/paper/green-finance-and-accounting-accounting-and-reporting-of-3epfw1lj4hw7","2024","Journal Article","","Mehmet Ali Yüzbaşıoğlu","10.71097/ijsat.v15.i4.1392","","This paper delves deeply into the critical intersection of green finance and accounting, focusing on the intricate mechanisms for effective accounting and reporting of environmentally friendly financial products. As the pressing issues of climate change and environmental degradation continue to present significant global challenges, financial institutions are increasingly acknowledging the urgent necessity of integrating sustainability into their everyday practices. The study highlights the noteworthy emergence of green finance in direct response to these persistent issues, detailing various innovative financial products that have been specifically tailored to support a wide range of environmental initiatives, such as green bonds, sustainable investment funds, and eco-friendly loans designed to promote ecological sustainability. Additionally, it closely examines the essential accounting standards and comprehensive reporting frameworks that are crucial for ensuring transparency and accountability for these impactful products, including the vital roles played by regulatory bodies and international guidelines that govern these practices. By meticulously analyzing a variety of case studies and identifying best practices in the sector, this research aims to offer valuable insights into how effective accounting and thorough reporting can significantly enhance the credibility of green financial products, thereby stimulating greater investment in sustainability initiatives. Ultimately, this could lead to the promotion of a more sustainable and resilient economy capable of addressing the challenges of the future. ","This study explores green finance and accounting, focusing on environmentally friendly financial products, such as green bonds and eco-friendly loans, and examines accounting standards and reporting frameworks for transparency and accountability in sustainability initiatives."
"Enhancing mitigation and finance reporting","https://scispace.com/paper/enhancing-mitigation-and-finance-reporting-538nlcxcli","2017","Report Series","","Lola Vallejo
Sara Moarif
Aidy Halimanjaya","10.1787/5E354935-EN","","The future enhanced transparency framework outlined in the Paris Agreement and its accompanying Decision is to build on, enhance and eventually supersede the existing measurement, reporting and verification (MRV) system established under the Cancun Agreements. This paper explores the issues of “building on” and “enhancing” as they relate to the biennial reporting of information on mitigation and finance, by drawing lessons from the existing MRV system and examining the Paris Agreement’s provisions. It examines four areas: greenhouse gas (GHG) inventories, reporting on progress with the mitigation component of nationally determined contributions (NDCs), finance provided and mobilised, and financial support received and needed. The paper also highlights the challenges met by Parties while reporting information for these areas to date, and provides suggestions on how forthcoming modalities, procedures and guidelines (MPGs) might reduce these difficulties.","The future enhanced transparency framework outlined in the Paris Agreement and its accompanying Decision is to build on, enhance and eventually supersede the existing measurement, reporting and verification (MRV) system established under the Cancun Agreements as discussed by the authors."
"Accounting for Carbon","https://scispace.com/paper/accounting-for-carbon-32j99dh3m5","2015","Posted Content","Research Papers in Economics","Valentin Bellassen
Nicolas Stephan","","","The ability to accurately monitor, record, report and verify greenhouse gas emissions is the cornerstone of any effective policy to mitigate climate change. Accounting for Carbon provides the first authoritative overview of the monitoring, reporting and verification (MRV) of emissions from the industrial site, project and company level to the regional and national level. It describes the MRV procedures in place in more than fifteen of the most important policy frameworks - such as emissions trading systems in Europe, Australia, California and China, and the United Nations Framework Convention on Climate Change - and compares them along key criteria such as scope, cost, uncertainty and flexibility. This book draws on the work of engineers and economists to provide a practical guide to help government and non-governmental policymakers and key stakeholders in industry to better understand different MRV requirements, the key trade-offs faced by regulators and the choices made by up-and-running carbon pricing initiatives.","In this article, the authors provide an overview of the monitoring, reporting and verification (MRV) of emissions from the industrial site, project and company level to the regional and national level."
"Double Counting of Emission Reductions Undermines the Credibility of Corporate Mitigation Claims","https://scispace.com/paper/double-counting-of-emission-reductions-undermines-the-3jyicetdlt","2024","Journal Article","Environmental Science & Technology","Guosong Ma
Maosheng Duan","10.1021/acs.est.4c03792","","Companies are increasingly relying on emission reductions attributable to their adoption of renewable electricity to achieve net-zero emission targets. However, there is a risk of double counting of emission reductions threatening the credibility of corporate climate actions due to defective accounting rules of GHG emissions related to electricity consumption and the overlap between different market-based instruments, including carbon credit markets, renewable power purchase agreements, and renewable energy certificates. Using data of 63 major Chinese companies in seven sectors, we quantitatively assess the risks of double counting related to corporate sourcing of renewables and their consequent influences on the alignment of corporate emission trajectories with the 1.5 °C goal of the Paris Agreement. Results show that 7.1% of the electricity consumed by sample companies in 2021 was from renewable energy procurement and deployment, with which they reported 8.27 Mt of CO2e emission reductions compared to the scenario with no renewable electricity consumption. However, emission reductions that could be double counted are predicted to be 0.9–1.3 times as many as emission reductions that companies will report during 2021–2030. After adjustment of the reported emissions that might be underestimated due to double counting, the overall emission trajectories of sample companies are no longer aligned with the 1.5 °C goal. Our findings suggest that it is urgently needed to improve the corporate carbon accounting rules and increase the transparency of corporate carbon disclosures. ","Double counting of emission reductions undermines the credibility of corporate mitigation claims, potentially leading to inaccurate emission trajectories and misaligned climate goals."
"Measurement, reporting and Verification (MRV) of non-CO2 greenhouse gases: International Best Practices and Suggestions for China","https://scispace.com/paper/measurement-reporting-and-verification-mrv-of-non-co2-1kdlmh9jlz","2023","","","Nina Khanna
Xu Liu
Jiang Lin","10.2172/2228452","","Measurement, Reporting, and Verification (MRV) is a systematic approach to tracking and documenting greenhouse gas (GHG) emissions and emission reductions. MRV can be used across all sectors and for all GHGs to track emissions patterns, evaluate programs, and promote transparency. As methane and other short-lived climate pollutants become critical to mitigating near-term climate change impacts, MRV systems become critical in improving emission inventories; facilitating the development of climate change policies and targets, and tracking and demonstrating progress towards sustainable development. This report focuses on current sectoral issues – including the emerging roles for satellites and remote sensing technologies - and international best practices in MRV policies and programs for non-carbon dioxide (CO2) GHGs including methane, nitrous oxide (N2O), and hydrofluorocarbons (HFCs) in specific sectors. Based on international best practices and a review of China’s current MRV system, we offer suggestions for a possible path forward for developing and implementing a stronger non-CO2 MRV system. ","This report outlines international best practices for measuring, reporting, and verifying non-CO2 greenhouse gas emissions, focusing on methane, N2O, and HFCs, and provides suggestions for China to develop a stronger MRV system, leveraging satellite and remote sensing technologies."
