"Paper Title","Paper Link","Publication Year","Publication Type","Publication Title","Author Names","DOI","PDF Link","Abstract","TL;DR"
"GHG Mitigation Actions: MRV Issues and Options","https://scispace.com/paper/ghg-mitigation-actions-mrv-issues-and-options-1e53watv4x","2009","Posted Content","","Jane Ellis
Sara Moarif","","","The Bali Action Plan (BAP) language on “measurable, reportable and verifiable” (MRV) greenhouse gas mitigation actions and commitments for a post-2012 climate framework was introduced to apply both to developed countries’ greenhouse gas (GHG) commitments and actions (paragraph 1(b)(i) of the BAP), as well as to “nationally appropriate mitigation actions by developing country Parties in the context of sustainable development, supported and enabled by technology, financing and capacity-building” (paragraph 1(b)(ii)). This paper provides an overview of current efforts to assess if GHG mitigation actions underway in different countries and regions are “measurable, reportable and verifiable”. The paper also assesses how such efforts could be improved, explores MRV options for different types of GHG mitigation actions, and highlights decision points needed to establish a post-2012 framework.Several different types of GHG mitigation actions and commitments have been proposed for the post-2012 period. Some of these - such as national-level GHG emission limits - are already being used, with countries therefore already gaining experience with implementing, monitoring, reporting (and potentially reviewing or verifying the effects of) such actions/commitments. The extent of this experience varies both by type of action/commitment, as well as by country and sector. In general, Annex I countries have significant experience with monitoring and reporting national emission levels (reflecting their reporting commitments under the UNFCCC and Kyoto Protocol). However, official reporting on other GHG-mitigation actions occurs every few years in Annex I countries and only irregularly in non-Annex I countries. Thus, significant new guidance would be needed if post-2012 MRV provisions were to focus on GHG mitigation actions rather than GHG emission levels.In deciding a MRV framework, it will be important to consider measurement, reporting and verification issues separately (as for example some non-supported actions may be reported but not verified). A transition process may also be needed for some countries, in terms of what is to be subject to MRV provisions, and how M, R and V are to be carried out. Les termes « mesurables, notifiables et verifiables » (MNV) utilises dans le Plan d’action de Bali pour qualifier les initiatives et les engagements en matiere d’attenuation des emissions de gaz a effet de serre (GES) envisages dans le cadre climatique pour l’apres 2012 s’appliquent a la fois aux engagements et initiatives d’attenuation des emissions de GES des pays developpes (paragraphe 1(b)(i) du Plan de Bali), et aux « mesures d’attenuation appropriees au niveau national de la part des pays en developpement parties dans le cadre d’un developpement durable, soutenues et rendues possibles par des technologies, des moyens de financement et un renforcement des capacites » (paragraphe 1(b)(ii)). Le present document passe en revue les efforts deployes actuellement pour evaluer si les initiatives d’attenuation des emissions de GES lancees dans les differents pays et regions sont « mesurables, notifiables et verifiables ». Il etudie en outre comment ces efforts pourraient etre ameliores, considere les options MNV pour differents types d’initiatives d’attenuation et fait ressortir les questions qu’il faudra trancher pour etablir un cadre pour l’apres-2012. Differents types d’engagements et d’initiatives d’attenuation des emissions de GES ont ete proposes pour l’apres-2012. Certains, comme les plafonds nationaux d’emissions de GES, sont deja utilises, ce qui permet a des pays d’acquerir d’ores et deja une experience de la mise en oeuvre, du suivi et de la notification de ces initiatives/engagements (et eventuellement de l’examen ou de la verification de leurs effets). L’ampleur de ces experiences varie selon le type d’initiative/d’engagement et selon les pays ou secteurs consideres. En general, les pays vises a l’Annexe I ont une grande experience du suivi et de la notification de leurs emissions nationales (en vertu des engagements de notification souscrits au titre de la CCNUCC et du Protocole de Kyoto). Cependant, les communications officielles sur les autres mesures prises pour attenuer les emissions de GES ne sont presentees qu’a plusieurs annees d’intervalle dans le cas des pays vises a l’Annexe I, et de facon sporadique dans celui des autres pays. En consequence, de nouvelles directives seront necessaires s’il est decide qu’apres 2012 les dispositions relatives a la MNV s’appliqueront non plus aux niveaux d’emission mais aux initiatives d’attenuation des emissions de GES. Pour etablir un cadre MNV, il importera de considerer separement les questions de mesure, de notification et de verification (sachant que par exemple, certaines initiatives mises en oeuvre en l’absence de soutien peuvent etre notifiees mais pas verifiees). Un processus de transition pourrait egalement etre necessaire pour certains pays, portant sur le champ d’application des dispositions relatives a la MNV et les modalites de M, N et V.","In this article, the authors provide an overview of current efforts to assess if GHG mitigation actions underway in different countries and regions are ""measurable, reportable and verifiable"" and highlight decision points needed to establish a post-2012 framework."
"Keeping Track: Options to Develop International Greenhouse Gas Unit Accounting after 2012","https://scispace.com/paper/keeping-track-options-to-develop-international-greenhouse-37e0lerxgx","2011","Report Series","Research Papers in Economics","Andrew Prag
André Aasrud
Christina Hood","10.1787/5K450QB83VQ8-EN","https://scispace.com/pdf/keeping-track-options-to-develop-international-greenhouse-37e0lerxgx.pdf","This paper examines environmental and institutional implications of the use of tradable GHG units under different international accounting scenarios in the post-2012 international climate change policy framework. A range of possible scenarios is presented based on analysis on various building blocks for emissions accounting. On one side continuation of a Kyoto Protocol type accounting approach is considered with allocation of centrally-administered emissions allowances for Annex I countries. On the other side, a less centralised system is presented based on emission reduction pledges by countries.
Aspects of these two scenarios are then combined to identify common elements in a middle ground scenario. The middle ground scenario presented would not use centrally-allocated emissions allowances but would retain some level of commonly-agreed accounting rules to ensure shared understanding of the content and scope of pledges, and to provide a stable platform for international use of offset units. The middle-ground scenario also envisages a role for UNFCCC bodies to set standards for new credit-based market mechanisms, and suggests that the existing International Transaction Log might be modified to track new unit types in addition to existing Kyoto Protocol units. Transparent tracking of units would help to minimize the risk of “double counting” of emissions reductions towards the emissions objective of more than one country.","In this article, environmental and institutional implications of the use of tradable GHG units under different international accounting scenarios in the post-2012 international climate change policy framework are examined. And the authors present a range of possible scenarios based on analysis on various building blocks for emissions accounting."
"Could Accountant Be Facilitator To Zero Net Emission Programs?","https://scispace.com/paper/could-accountant-be-facilitator-to-zero-net-emission-178qwet9s8","2023","Journal Article","Journal Research of Social Science, Economics, and Management","Yanuar Ramadhan
Achmad Rifai
Dwi Septiani
Fahri Hananto Yasin
Lenny Widiawati
Stefany Caroline","10.59141/jrssem.v3i3.564","https://scispace.compdf/could-accountant-be-facilitator-to-zero-net-emission-178qwet9s8.pdf","The study aims to highlight the role of accountants in supporting and facilitating the implementation of the Net Zero Emission Programme in Indonesia with a focus on emission measurement and reporting, sustainable financial management, related audits and verification, as well as its impact on environmental sustainability and the achievement of climate change targets. The research is based on a qualitative approach of literature review using data in the form of annual reports and sustainability reports from mining companies in 2022 as well as from various related research journals. The results of this study show that accountants have a key role to play in helping companies and organizations achieve zero emission targets while ensuring compliance with relevant regulations. They can also help in measuring the financial impact of sustainability initiatives and make transparent reports to stakeholders.","Accountants play a key role in supporting and facilitating the implementation of the Net Zero Emission Programme in Indonesia by assisting companies with emission measurement and reporting, sustainable financial management, audits and verification, and reporting on environmental sustainability."
"Climate and carbon markets: opportunities and barriers for merging instruments","https://scispace.com/paper/climate-and-carbon-markets-opportunities-and-barriers-for-srvdc4h6m7","2024","Journal Article","Economic scope","Ihor Soloviy
Yaroslav Panchyshyn","10.32782/2224-6282/191-66","","The purpose of the article is to identify the prerequisites, features, advantages and disadvantages of climate financing as a type of environmental and sustainable financing in combination with carbon markets and prospective ways of developing this activity. The article provides an overview of the definitions, essence, and interrelation of climate, environmental, and sustainable financing. Public climate finance should serve to create an enabling environment by providing technical assistance funds to help project implementers overcome various technical, financial and institutional barriers .Besides that, climate finance should, reduce the risks of direct capital investments by covering additional costs for targeted emissions reduction or adaptation measures. To achieve this, such funding can be provided either upfront to reduce capital costs or in the form of payment for results to offset operational costsAttention is paid to the main aspects and differences in the functioning of mandatory and voluntary carbon markets. The importance of combining state climate financing with carbon market instruments is argued. The main barriers to such a combination, which recipient countries have faced, are analyzed. It is proven that achieving many Sustainable Development Goals (SDGs) and implementing the Paris Climate Agreement requires a significant increase in the volumes of new climate financing with simultaneous maximization of ancillary benefits from various results, including for local communities. Recommendations have been formed to increase the level of standardization, harmonization of standards, and disclosure of non-financial information published by companies and used to assess climate risks. ","This article explores the opportunities and barriers of merging climate financing with carbon markets, highlighting the importance of combining state climate financing with carbon market instruments to achieve Sustainable Development Goals and the Paris Climate Agreement."
"Transparency of Financial Reporting on Greenhouse Gas Emission Allowances: The Influence of Regulation.","https://scispace.com/paper/transparency-of-financial-reporting-on-greenhouse-gas-onf98s56tz","2020","Journal Article","International Journal of Environmental Research and Public Health","Patricia Milanés Montero
Esteban Pérez Calderón
Ana Isabel Lourenço Dias","10.3390/IJERPH17030893","https://scispace.com/pdf/transparency-of-financial-reporting-on-greenhouse-gas-onf98s56tz.pdf","This study focuses on the transparency of financial reporting on emission allowances (EA) and greenhouse gas (GHG) emissions within the European Union Emissions Trading Scheme (EU ETS). In particular, the different accounting treatments adopted by standard setters and professionals were analyzed to evaluate the influence of regulation in the transparency of financial reporting on EA and GHG emissions. Based on a sample of 85 companies registered with the Portuguese, Spanish, and French National Plans of Allocation (NPAs), data collected from the annual reports were analyzed for the 2008–2014 period. The results were obtained based on descriptive, logistic regressions and panel data statistical techniques, and they show that better levels of transparency of financial reporting on EA and GHG emissions are conditioned by a variety of accounting policies, which compromises the comparability of the financial information. The adoption of the International Accounting Standards Board (IASB) standards set lead to a greater dispersion in the choice of the accounting approach and a higher probability of not disclosing any information, as well as adopting off-balance sheet policies. Therefore, the regulatory factor is a determinant of the level of transparency of financial reporting on EA and GHG emissions, contributing to reduce strategies of omission.","In this paper, the authors analyzed the influence of regulation in the transparency of financial reporting on emission allowances (EA) and greenhouse gas (GHG) emissions within the European Union Emissions Trading Scheme (EU ETS) and found that the adoption of the International Accounting Standards Board (IASB) standards set lead to a greater dispersion in the choice of the accounting approach and a higher probability of not disclosing any information, as well as adopting off-balance sheet policies."
"Mainstreaming Climate Change into Financial Governance: Rationale and Entry Points","https://scispace.com/paper/mainstreaming-climate-change-into-financial-governance-2dsv60vwnb","2015","","","Sani Zou
Romain Morel
Thomas J. Spencer
Ian Cochran
Michel Colombier","","https://scispace.com/pdf/mainstreaming-climate-change-into-financial-governance-2dsv60vwnb.pdf","• Although crucial, classic climate policies — such as carbon pricing, emission standards and technology objectives — do not appear sufficient to address the challenges from climate change that the financial sector is facing. Policies affecting the demand side and supply side of finance, as well as instruments matching supply and demand, need to be aligned with climate objectives to efficiently shift investments toward a low-carbon, climate-resilient economy.","In this paper, the authors argue that classic climate policies, such as carbon pricing, emission standards and technology objectives, do not appear sufficient to address the challenges from climate change that the financial sector is facing."
"Comparing Definitions and Methods to Estimate Mobilised Climate Finance","https://scispace.com/paper/comparing-definitions-and-methods-to-estimate-mobilised-4jj0wylvuv","2013","Report Series","Research Papers in Economics","Randy Caruso
Jane Ellis","10.1787/5K44WJ0S6FQ2-EN","https://scispace.com/pdf/comparing-definitions-and-methods-to-estimate-mobilised-4jj0wylvuv.pdf","At the 16th Conference of the Parties (COP) in 2010, developed countries formalised a collective climate finance commitment made previously in Copenhagen of “mobilising jointly USD 100 billion per year by 2020 to address the needs of developing countries...from a wide variety of sources, public and private, bilateral and multilateral, including alternative sources” (UNFCCC, 2010). However, there is currently no definition of which “climate” activities, flows, or other interventions could count towards the USD 100 billion; what “mobilising” means; or even which countries are covered by this commitment. The paper examines different definitions used by 24 key actors in climate finance to quantify the level of private climate finance mobilised by their interventions, as well as the methods used to track such private climate finance. Key findings are that i) methodologies to assess and estimate mobilisation vary widely, and ii) considerable risk of double-counting exists.","This article examined different definitions used by 24 key actors in climate finance to quantify the level of private climate finance mobilised by their interventions, as well as the methods used to track such private finance."
"Corporate carbon reporting: Improving transparency and accountability","https://scispace.com/paper/corporate-carbon-reporting-improving-transparency-and-3joab4pz","2023","Journal Article","One earth","Stephen Comello
Julia Reichelstein
Stefan Reichelstein","10.1016/j.oneear.2023.06.002","","Numerous multinational firms have recently pledged to reduce their greenhouse gas emissions to a net-zero position by the year 2050. These pledges currently lack a unified measurement and reporting structure, leaving the public unsure about the extent of the corporate commitments. Here, we propose a time-consistent corporate carbon reporting (TCCR) standard that entails an initial forecast of a firm’s future carbon emissions trajectory, periodic revisions of the earlier forecasts, and updates on emissions reductions actually achieved at different points in time. The TCCR standard is applicable to alternative carbon footprint metrics, including a company’s direct emissions, carbon emissions in goods sold, or the carbon footprint assessed for individual sales products. Companies adopting the TCCR standard will provide added transparency and accountability for their carbon disclosures. Numerous multinational firms have recently pledged to reduce their greenhouse gas emissions to a net-zero position by the year 2050. These pledges currently lack a unified measurement and reporting structure, leaving the public unsure about the extent of the corporate commitments. Here, we propose a time-consistent corporate carbon reporting (TCCR) standard that entails an initial forecast of a firm’s future carbon emissions trajectory, periodic revisions of the earlier forecasts, and updates on emissions reductions actually achieved at different points in time. The TCCR standard is applicable to alternative carbon footprint metrics, including a company’s direct emissions, carbon emissions in goods sold, or the carbon footprint assessed for individual sales products. Companies adopting the TCCR standard will provide added transparency and accountability for their carbon disclosures. ","A time-consistent corporate carbon reporting (TCCR) standard was proposed in this paper , which is applicable to alternative carbon footprint metrics, including a company's direct emissions, carbon emissions in goods sold, or the carbon footprint assessed for individual sales products."
"The Case for Building Climate Reporting into Financial Accounting","https://scispace.com/paper/the-case-for-building-climate-reporting-into-financial-mlny9elv66eb","","","","Richard Murphy
Leonard Seabrooke","10.7146/samfundsokonomen.v2019i4.140639","","For mitigation efforts against climate breakdown to be effective they need to bring in the private sector in a meaningful way. Current standards for financial reporting for commercial organizations focus on the interests of capital suppliers to the exclusion of other stakeholders and civil society. These stakeholders include the suppliers of capital, trading partners, employees, regulators, tax authorities, and civil society. So far initiatives to include environmental and social costs have been additive rather than substantive. In this think piece we offer a radical proposal in the form of sustainable cost accounting (SCA). As a standard SCA would build on existing accounting principles to require commercial organizations to report on how they will manage the costs of becoming net carbon zerocompliant. SCA does not include carbon pricing or the cost of offsets. It would require the commercial organization to establish the costs of the transition to carbon neutrality. Regulatory requirements, enmeshment in transnational standards, and adequate auditing would implement SCA. If SCA was mandatory and comprehensively applied it would take a significant step in bringing business onside in addressing climate breakdown.","This think piece proposes Sustainable Cost Accounting (SCA) to integrate climate reporting into financial accounting, requiring commercial organizations to disclose costs of transitioning to net carbon neutrality, promoting business involvement in addressing climate breakdown."
"Management Control, Performance Measurement, and Climate Risk Management Perspectives for Carbon Accounting","https://scispace.com/paper/management-control-performance-measurement-and-climate-risk-g2rasrvoxbz8","2025","Journal Article","","Tarek Rana
Md Jahidur Rahman
Peter Öhman","10.4324/9781003488965-22","","This chapter investigates the pivotal role of carbon accounting within the domains of management control, performance measurement, and climate risk management. As organizations worldwide face increasing pressures to enhance environmental stewardship, carbon accounting has emerged as a vital tool for quantifying and managing greenhouse gas emissions. This chapter elucidates the integration of carbon accounting into management control systems and performance measurement frameworks, highlighting its significance in fostering corporate transparency, accountability, and sustainability performance. The discussion emphasizes the necessity of a robust regulatory framework to standardize and institutionalize carbon accounting practices. The chapter also underscores the critical need for professional development to address the shortage of skilled practitioners in green accounting. By incorporating carbon metrics into performance measurement systems, organizations can align sustainability goals with strategic and operational objectives, thus achieving a comprehensive view of their performance. Empirical evidence presented in this chapter demonstrates the positive correlation between robust carbon accounting practices and improved environmental and financial performance. The chapter further explores how integrating carbon accounting with climate risk management frameworks enhances organizational resilience to climate-related risks and positions companies to capitalize on opportunities arising from the transition to a low-carbon economy. Moreover, the chapter highlights the potential of technological advancements such as blockchain, artificial intelligence, and the Internet of Things to enhance the accuracy, efficiency, and transparency of carbon accounting practices. The insights provided offer valuable guidance for academics, practitioners, and policymakers committed to advancing sustainable development and environmental stewardship. ","This chapter explores the integration of carbon accounting into management control systems, performance measurement frameworks, and climate risk management, highlighting its significance in fostering corporate transparency, accountability, and sustainability performance, and its positive correlation with environmental and financial performance."
