"Paper Title","Paper Link","Publication Year","Publication Type","Publication Title","Author Names","DOI","PDF Link","Abstract","TL;DR"
"A strategic approach towards sustainable development: Scaling climate finance mechanisms for climate change in India","https://scispace.com/paper/a-strategic-approach-towards-sustainable-development-scaling-fxvxf5v8vhlb","2025","Journal Article","International Journal of Accounting, Business and Finance","S. S. Sodha
Sanjay Bhayani","10.55429/ijabf.v3i2.148","","Climate change poses a significant threat to the global community, particularly impacting vulnerable populations in developing countries. This paper provides an in-depth examination of climate finance, illustrating its definition, sources, instruments, and implications for developing countries. The paper also highlights key climate finance funds that serve as vital mechanisms for channeling financial resources to projects aimed at reducing emissions, enhancing resilience, and promoting sustainable development in developing countries. The study emphasizes the importance of a strategic approach to secure the necessary funding for India's ambitious transition outlined in its Long-Term Low Emission Development Strategy submitted at COP27. It suggests four pillars of India's climate finance strategy: private sector engagement, international partnerships, diverse financial instruments, and innovation finance. By outlining these pillars, the paper aims to assist Indian policymakers and stakeholders develop a strong and efficient climate finance strategy to achieve their climate objectives while promoting sustainable development. ","This paper examines climate finance mechanisms for sustainable development in India, highlighting key funds and a strategic approach with four pillars: private sector engagement, international partnerships, diverse financial instruments, and innovation finance to achieve climate objectives."
"Rebalancing climate finance: Analysing multilateral development banks' allocation practices","https://scispace.com/paper/rebalancing-climate-finance-analysing-multilateral-rz9kf6je","2023","Journal Article","Energy research and social science","Lina Xie
Bert Scholtens
Swarnodeep Homroy","10.1016/j.erss.2023.103127","","This paper provides novel evidence on the climate financing practices of Multilateral Development Banks (MDBs) and their long-term social and climate consequences. We find that the majority of MDB climate finance is for mitigation projects, concentrated in a few relatively wealthy countries, and positively correlates with countries' greenhouse gas emissions but not with their vulnerability to climate risks. A transition towards a more equal allocation between mitigation and adaptation can substantially reduce global climate vulnerability for an additional 1.9 billion people without significant changes in the annualized growth rate of emissions. Our results contribute to the discussion on global equity in climate finance allocation and the societal impact of climate change. ","This paper found that the majority of MDB climate finance is for mitigation projects, concentrated in a few relatively wealthy countries, and positively correlates with countries' greenhouse gas emissions but not with their vulnerability to climate risks."
"Does Climate Finance Matter? The Relationship between Climate Finance and Carbon Dioxide Emissions in Developing Countries","https://scispace.com/paper/does-climate-finance-matter-the-relationship-between-climate-yhckterfwlxi","2025","Journal Article","International Journal of Energy Economics and Policy","Kelvin Lee Yong Ming
Nik Herda Nik Abdullah
Amira Mas Ayu Amir Mustafa
Siti Nurul Munawwarah Roslan
Ammar Asbi","10.32479/ijeep.19799","","This study examines the relationship between climate finance and carbon dioxide (CO₂) emissions in developing countries from 2015 to 2021. Using a sample of 74 countries, this study applies the two-step Generalized Method of Moments (GMM) estimation to examine the impact of climate finance on carbon dioxide emissions. The results indicate that climate finance for mitigation purposes is positively associated with CO₂ emissions. However, a higher income level is linked to lower emissions, likely due to stricter environmental policies and increased investment in renewable energy. Additionally, population growth contributes to higher emissions, while larger forest areas help reduce CO₂ levels by acting as carbon sinks. These findings highlight the importance of directing climate finance toward truly sustainable projects and ensuring effective policy implementation. The study underscores the need for well-targeted financial strategies that prioritize clean energy, energy efficiency, and low-carbon technologies. It also recommends further research on policy frameworks and institutional capacities to optimize the effectiveness of climate finance in reducing emissions. ","This study examines the relationship between climate finance and CO₂ emissions in 74 developing countries from 2015-2021, finding that climate finance for mitigation purposes is positively associated with emissions, but income level, population growth, and forest areas influence emissions differently."
"Assessing the role of climate finance in supporting developing nations: a comprehensive review","https://scispace.com/paper/assessing-the-role-of-climate-finance-in-supporting-by6cydxuve","2024","Journal Article","","Wags Numoipiri Digitemie
Ifeanyi Onyedika Ekemezie","10.51594/farj.v6i3.926","","Climate finance plays a critical role in supporting developing nations to mitigate and adapt to the impacts of climate change. This comprehensive review examines the multifaceted role of climate finance in assisting developing countries in their efforts to address climate change challenges. The review begins by providing an overview of the global climate finance landscape, highlighting key sources of climate finance, including public funds, private investments, and innovative financing mechanisms. It then explores the allocation and distribution of climate finance, analyzing trends, disparities, and challenges in accessing and utilizing funds among developing nations. Furthermore, the review assesses the effectiveness of climate finance in supporting mitigation and adaptation activities in developing countries. It examines case studies and best practices to illustrate how climate finance has been utilized to finance renewable energy projects, enhance resilience in vulnerable communities, and promote sustainable development. Additionally, the review evaluates the governance and institutional frameworks governing climate finance, including the role of international financial institutions, national governments, and civil society organizations in mobilizing and disbursing funds. Moreover, the review examines the challenges and opportunities associated with scaling up climate finance to meet the growing needs of developing nations. It discusses issues such as financial transparency, accountability, and the alignment of climate finance with national development priorities. Additionally, the review explores innovative financing mechanisms, such as green bonds, climate insurance, and carbon pricing, as potential avenues for mobilizing additional resources for climate action in developing countries. In conclusion, this comprehensive review underscores the importance of climate finance in supporting developing nations to address climate change challenges and achieve sustainable development goals. It highlights the need for enhanced international cooperation, policy coherence, and investment mobilization to accelerate climate action and build resilience in the most vulnerable regions. By leveraging climate finance effectively and efficiently, developing countries can transition to low-carbon, climate-resilient economies while advancing their development objectives. 
Keywords:  Assess, Climate, Finance, Developing Nations, Support.","Climate finance plays a critical role in supporting developing nations in addressing climate change challenges and achieving sustainable development goals. It involves providing an overview of the global climate finance landscape, exploring allocation and distribution trends, assessing effectiveness in mitigation and adaptation activities, evaluating governance frameworks, and discussing challenges and opportunities."
"Response to the Financial Accounting Standards Board’s “Proposed Accounting Standards Update—Government Grants (Topic 832): Accounting for Government Grants by Business Entities”","https://scispace.com/paper/response-to-the-financial-accounting-standards-boards-djav71csreth","2025","Journal Article","Journal of financial reporting","Rosemond Desir
Ryan V. Hess
Michael Iselin
Ray J. Pfeiffer
George W. Ruch
Christian Stadler","10.2308/jfr-2025-018","","ABSTRACT This paper summarizes a comment letter we submitted to the Financial Accounting Standards Board in March 2025 in response to its Proposed Accounting Standards Update on accounting for government grants by business entities. We submitted a comment letter at the request of the Financial Reporting Policy Committee, which is charged by the Financial Accounting and Reporting Section of the American Accounting Association with responding to requests for comment from standard setters on financial reporting issues. The proposed amendments aim to establish authoritative guidance on accounting for government grants received by business entities. We conclude that the proposed amendments will not provide decision-useful information to financial statement users. We detail the concerns underlying this conclusion and offer recommendations to address them. We also summarize findings from academic research and offer suggestions for future research. JEL Classifications: M41; M48. ","This paper critiques the Financial Accounting Standards Board's proposed update on accounting for government grants by business entities, arguing that the amendments lack decision-useful information and offering recommendations to address concerns, with implications for financial reporting policy and future research."
"Introduction to the Handbook of International Climate Finance: is climate finance a meteoric fashion or a stable pillar of the global response to anthropogenic climate change?","https://scispace.com/paper/introduction-to-the-handbook-of-international-climate-1uw8s2bs","2022","Book Chapter","","","10.4337/9781784715656.00005","","The concept of international climate finance channelled from developed to developing countries has been developed over the last decade, but its roots date back to the early 1990s. Despite the high relevance of the topic in the international climate negotiations, illustrated by the (missed) target to mobilise USD 100 billion by 2020, there is no book that provide an overview accessible to practitioners and the interested public alike. The Handbook of International Climate Finance closes this gap by bringing together experts and practitioners who have been working on international climate finance, looking how the international community can learn from the past to achieve a brighter future. On the basis of the definition of international climate finance as transboundary flows of finance triggered by public interventions for mitigation and adaptation, our contributors assess past approaches to international climate finance like fast start finance, discuss effectiveness of different channels for climate finance like the Green Climate Fund, debate challenges encountered and elucidate national strategies of donors and recipients, such as Switzerland and Rwanda. The role of different interest groups is discussed throughout chapters. An important section of the Handbook elaborates perspectives for international climate finance through multilateral channels, from the private sector, and blending of different sources of finance, including international carbon markets. ","The Handbook of International Climate Finance as discussed by the authors provides an overview of international climate finance by bringing together experts and practitioners who have been working on climate finance, looking how the international community can learn from the past to achieve a brighter future. But despite the high relevance of the topic in the international climate negotiations, illustrated by the missed target to mobilise USD 100 billion by 2020, there is no book that provide an overview accessible to practitioners and the interested public alike."
"Does Climate Finance Achieve Its Goals in Developing Countries? An Econometric Assessment of Mitigation and Adaptation Outcomes.","https://scispace.com/paper/does-climate-finance-achieve-its-goals-in-developing-zt88pryv6665","2025","Journal Article","","Bolin Wei","10.21203/rs.3.rs-6062326/v1","","<title>Abstract</title> Despite the increasing mobilization of climate finance under international frameworks, its effectiveness in achieving tangible mitigation and adaptation outcomes in developing countries remains empirically underexamined. This study evaluates the effectiveness of climate finance in developing countries by examining its impact on both greenhouse gas (GHG) emissions mitigation and climate adaptation outcomes. Using panel data from 30 developing countries over the period 2010–2021 and applying fixed-effects econometric models, the analysis investigates the effects of total climate finance, as well as disaggregated mitigation and adaptation flows, on key indicators including GHG emissions, agricultural productivity, water resource efficiency, and climate-induced economic losses. The results indicate that a 1% increase in total climate finance is associated with a 0.03% reduction in GHG emissions, highlighting its role in supporting low-carbon transitions. Mitigation finance demonstrates a significant positive impact on agricultural productivity but exhibits limited influence on water resource efficiency. Conversely, adaptation finance shows a positive correlation with economic losses in the short term, potentially reflecting the reactive allocation of funds to highly vulnerable regions. These findings suggest the need for more proactive and synergistic financing strategies. Policy implications include prioritizing long-term resilience investments, enhancing the balance between mitigation and adaptation allocations, and improving evaluation frameworks to maximize the effectiveness of climate finance in achieving sustainable development goals. ","This study assesses climate finance's effectiveness in developing countries, finding a 0.03% GHG emissions reduction per 1% increase in total climate finance, but mixed results for mitigation and adaptation finance on agricultural productivity, water resource efficiency, and climate-induced economic losses."
"Climate Policy with the Chequebook An Economic Analysis of Climate Investment Support","https://scispace.com/paper/climate-policy-with-the-chequebook-an-economic-analysis-of-4n74nygb3t","2017","Journal Article","Economics of Energy and Environmental Policy","Karol Kempa
Ulf Moslener","10.5547/2160-5890.6.1.KKEM","","Across the globe, climate policy is increasingly using investment support instruments, such as grants, concessional loans, and guarantees - whereas carbon prices are losing importance. This development substantially increases the risk of inefficient public spending. In this paper, we examine the ability of finance instruments to effectively and efficiently address market failures related to clean energy investments. We characterise these market imperfections - emission externalities, knowledge spillovers and capital market imperfections - and identify their negative impacts on the investor-relevant risk-return characteristics. We argue that finance instruments are able to address the effects of these market failures. However, a carbon price is superior in internalising the emission externalities. With respect to the latter two inefficiencies, investment support instruments can effectively compensate the market failures if designed appropriately. We further provide policy recommendations on the choice of finance instruments to address the various market failures and guidance on how to use these instruments avoiding inefficient government spending.","In this paper, the authors examine the ability of finance instruments to effectively and efficiently address market failures related to clean energy investments and identify their negative impacts on the investor-relevant risk-return characteristics."
"The Unequal Distribution of International Climate Finance Flows and Its Underlying Drivers","https://scispace.com/paper/the-unequal-distribution-of-international-climate-finance-39oo4aqq","2022","Posted Content","","Jamie Rickman
Sumit Kothari
Francesca Larosa
Nadia Ameli","10.21203/rs.3.rs-1188981/v1","https://scispace.com/pdf/the-unequal-distribution-of-international-climate-finance-39oo4aqq.pdf","
 Developed country pledges to provide finance to developing countries for their mitigation actions and adaptation needs sit at the heart of international climate cooperation. Present commitments are deficient both in terms of their quantity and their distribution among developing countries. Using wind and solar energy financing data we highlight the unequal distribution of international climate finance among developing countries and identify the determinants of investment suitability that drives the flows of non-aid climate finance more generally. Economic capabilities, business environment, climate policy environment and electricity access levels are significant drivers of private finance flows, whereas public finance is driven chiefly by domestic climate policy ambition since the Paris Agreement. Climate-vulnerable countries however struggle to access finance, with path dependency in investment flows further reinforcing existing inequalities. Forthcoming deliberations on quantifying long-term finance targets should thus incorporate mechanisms to distribute finance more equitably to meet country-specific needs and priorities.","In this paper , the unequal distribution of international climate finance among developing countries and identifying the determinants of investment suitability that drive the flows of non-aid climate finance more generally are highlighted."
"Global Climate Financing of Multilateral Development Banks - An Analysis","https://scispace.com/paper/global-climate-financing-of-multilateral-development-banks-3v7cdf0j","2022","Journal Article","Shanlax International Journal of Economics","Dhulasi Birundha Varadarajan
M. Chitra","10.34293/economics.v10i2.4747","","The human Community in earth understood theemergency need to integrate forces to avert dangerous climate change. This requires mobilising financial resources from a wide range of sources, public and private, bilateral and multilateral, including alternative sources. This makes it increasingly important to track and report financial flows that support climate change mitigation and adaptation to create trust and accountability with regard to climate related investment. Climate Financing by Multilateral Development Banks (MDBs) comprising the African Development Bank (AFDB) the Asian Development Bank (ADB) the European Bank for Reconstruction and Development (EBRD) the European investment Bank (EIB) the inter-American Development Bank Group (IDBG) the world Bank (WB) and the International Finance Corporation (IFC). The vision of Paris agreement’s in financial flows consistent with low greenhouse gas emissions and climate- resilient development plays a significant role in the MDBs work to improve tracking and reporting. At COP 24 in December 2018 the MDBs reinforced their commitment to combating climate change presenting joint approach that will align their activities with the goals of the internationalagreement. Based on the increasing role of MDB Banks in Climate Financing to different regions and sectors this paper focuses on the objectives such as To study climate Financing of Multilateral Banks and its role in minimising global CO2 emissions, To find the share of Adaptation Financeto total climate finance and also to determine the share of different banks in total adaptation funding. Based on the share, the moving pattern of financing by each group of banks would be analysed, to study the share of adaptation finance to total investments of funds in different sectors. The moving pattern of financing in different regions and sectors would also be observed. In order to study the variations in total amount allotted, amount for adaptation and amount on mitigation, Bank wise, Region wise and sector wise would be analysed. Data are collected from secondary sources for the years 2011 to 2018 from the reports of Multilateral Development joint report on climate finance. Regression was used to study the variation in variables such as total climate finance given by MDBs, Finance to Adaptation and Mitigation, Region wise financial distribution and sector wise allocation. The result of the study found that MDB banks are more innovative enough to distribute climate finance to various regions and to various sectors by pooling finance from various sources. Finance is given to countries to implement Adaptation and Mitigation measures separately. Comparatively finance to Adaptation is less to Mitigation. To utilize the Climate Finance more effectively MDB banks have to follow the approach of synthesizing both Adaptation finance and Mitigation Finance.","In this article , the authors study the role of multilateral development banks in climate finance and find the share of adaptation finance to total investments of funds in different sectors and the moving pattern of financing in different regions and sectors."
"How Concessional is Aid Lending","https://scispace.com/paper/how-concessional-is-aid-lending-ut35fumz8f","2008","Journal Article","Journal of Development Studies","David J. Potts
Woo Yong Chung","10.1080/00220380802150797","","The method used by Development Assistance Committee countries for measuring the concessionality of aid loans has remained unchanged for nearly 20 years. It was designed to measure the net cost of aid to donors not the net benefit to recipients. The discount rate used takes no account of changes in the value of the currency of the loan or of changes in prices for goods traded by recipient countries. Furthermore, it does not consider the implications of tying of aid or of policy conditionality. This paper suggests an alternative measure that shows the real net benefit of aid finance to recipients. It argues that the discount rate used by the Development Assistance Committee is too high and that changes in the value of the currency in which a loan is taken out can be important. Nevertheless, real rates of interest for developing countries remain surprisingly high despite low nominal rates due to falling prices of traded goods. This finding has implications for the future real cost of debt service to...","In this article, the authors argue that the discount rate used by the Development Assistance Committee is too high and that changes in the value of the currency in which a loan is taken out can be important."
"Climate-related development aid for renewable energy projects: an analysis of its trends and role in fostering the low carbon transition in official development aid recipients","https://scispace.com/paper/climate-related-development-aid-for-renewable-energy-1ltd3q4jid","2023","Book Chapter","","Cristina Peñasco","10.4337/9781800379022.00029","","The transition to low carbon economies is a necessary condition to fight the climate change threat. According to the IEA, the transformation needed to achieve net-zero CO2 emissions globally by 2050 requires an outstanding expansion of the investments made by the energy sector. However, investments in the generation of energy, and in particular electricity, with renewable sources are still perceived as risky, uncertain and associated with high capital needs. Green finance and, in particular, climate finance appear as a catalytic source of funds that can help attract other investments to this particular sector. In this chapter, we analyse the evolution and characteristics of climate-related development finance for the generation of electricity with renewable sources since the Copenhagen Accord in 2009, i.e. donors, recipients, technologies and instruments. Then, we revise the available policy instruments in the hands of governments to promote the transition to low carbon economies and the importance of policy mixes. Lastly, using a qualitative comparative analysis (QCA), we explore the simultaneous/complementary role played by those policy instruments and climate-related development finance for renewable energy projects in incentivising the transition to low carbon economies in ODA recipients. Results confirm the importance of different strategies and policy mixes depending on the level of development of the countries analysed. Those strategies imply different combinations of ODA, energy auctions, tax credits, renewable standards and carbon pricing. Understanding these relationships is key to fostering a faster low carbon energy transition. ","Climate-related development aid for renewable energy projects is essential for fostering the low carbon transition in official development aid recipients. It helps attract other investments and incentivizes the transition to low carbon economies."
