"Paper Title","Paper Link","Publication Year","Publication Type","Publication Title","Author Names","DOI","PDF Link","Abstract","TL;DR"
"Public climate finance: the challenge of reporting equity","https://scispace.com/paper/public-climate-finance-the-challenge-of-reporting-equity-1byoc22ro5","2017","Posted Content","Research Papers in Economics","Kris Bachus
Emilie Bécault","","","There is currently no agreed comprehensive methodology on how to track and report on public climate finance. One of the difficulties – next to determining the climate relevance of projects funded– is the valuation of financial instruments other than grants (i.e. loans, guarantees, equity). For loans, the calculation of the grant equivalent of the financial flow is relatively straightforward, but for equity, it is unclear what the best way is to value the grant equivalent. Hence, the primary objective of this research paper is to provide an overview of the variety of methods that can be used to value the provision of public climate finance to developing countries through equity investments. In this endeavour, special attention will be paid to recent debates taking place in the context of the modernisation of the OECD DAC statistical system about how to better represent the donor effort involved in extending private sector instruments and especially equity investments.","In this paper, the authors provide an overview of the variety of methods that can be used to value the provision of public climate finance to developing countries through equity investments, and special attention will be paid to recent debates taking place in the context of the modernisation of the OECD DAC statistical system about how to better represent the donor effort involved in extending private sector instruments and especially equity investments."
"The grant element method of measuring the concessionality of loans and debt relief","https://scispace.com/paper/the-grant-element-method-of-measuring-the-concessionality-of-40bkl9867r","2017","Report Series","Research Papers in Economics","Simon Scott","10.1787/19E4B706-EN","","The grant element is the “gift portion” of a financial transaction. The mathematical technique for arriving at a precise grant element percentage was first proposed by John Pincus of the RAND Corporation in 1963, and developed mathematically by Goran Ohlin of the Development Centre in 1966. Pincus also advocated expressing foreign aid in terms of its grant equivalent – i.e. the grant element expressed as a monetary value instead of a percentage. Grant element methodology was first used officially in 1969, in a target for softening the terms of aid. A grant element test was then introduced into the definition of official development assistance in 1972. Grant element methodology was subsequently applied to regulate the terms of export credits, to help assess the sustainability of developing country borrowing, and to calculate the level of debt relief and ensure comparability of effort in relevant Paris Club debt rescheduling operations. Central to grant element calculations is the selection of an appropriate discount rate to reflect financial market conditions. The present low interest rate environment raises challenges in this respect. This paper offers a layman’s introduction to the nature and mechanics of grant element methodology, and to the history of its application in practice.","The grant element is the ""gift portion"" of a financial transaction as mentioned in this paper, and is defined as the monetary value instead of a percentage of the total amount of money received by the recipient."
"Same but different? Understanding divergent definitions of and views on climate finance","https://scispace.com/paper/same-but-different-understanding-divergent-definitions-of-j3xim6db","2022","Book Chapter","","","10.4337/9781784715656.00007","","This chapter unpacks the diverging definitions and accounting methods of climate finance. Attaining consensus among Parties on these issues is crucial in light of the new collective quantified goal on climate finance that is being defined until the end of 2024. In the following we describe and discuss the main controversies - notably questions regarding the eligibility of climate-related activities and counting of different finance instruments towards international commitments, the relationship between climate and development finance as well as the accounting for of 'negative' climate finance. We argue that the international community needs high-level institutional change and leadership to facilitate a fast, goal-oriented and consensual process to resolve these issues. In the absence of such convergence, attaining the objectives of the Paris Agreement will continue to suffer from a hodgepodge of institutional approaches to defining, counting and accounting for climate finance. ","The authors unpacks the diverging definitions and accounting methods of climate finance and argues that the international community needs high-level institutional change and leadership to facilitate a fast, goal-oriented and consensual process to resolve these issues."
"Concessional financing windows or the need to reform the magic triangle","https://scispace.com/paper/concessional-financing-windows-or-the-need-to-reform-the-2k5b2w6r5t","2015","Posted Content","Research Papers in Economics","Chervalier Benoît","","","This study is published in advance of the major negotiations which will take place during 2015 on reforming concessional financing, most notably the Third International Conference on Financing for Development in Addis Ababa, Ethiopia. While this conference aims to address the broader issues of financing, calculating concessionality and what should be considered official development assistance (ODA), by including within it the various financial instruments which boost development finance in a form other than grants or loans, the multilateral development banks (MDBs) have launched a review focusing more narrowly on the future of their concessional financing windows.The organisational framework for the concessional financing offered by MDBs is based on mobilizing donor contributions to generate resources which are allocated, in the form of grants or highly subsidized loans and based on performance, to recipient governments while meeting their debt sustainability level. This system was put in place around 15 years ago, and has since undergone a succession of only minor adjustments. Special waivers have also stacked up, producing an excessively complicated system. It is the structure of this system which now needs to be rethought. But reform must be comprehensive and based on the ‘magic triangle’ in which resource mobilization, allocation of resources and debt sustainability management are closely linked and achieve an overall balance.Resources from traditional donors appear to have reached a climax. After the significant increase in ODA during the 2000s, reaching US$ 135.2 billion in 2014, and a highly focused political agenda, political mobilisation became more diffuse and was made more difficult by the budgetary constraints experienced by the main donors. It can therefore be reasonably expected that the level of concessional financing will see weak growth during the next replenishment cycles, with the notable exception of multilateral organisations focusing on an issue which is an international political priority with leadership at the highest level. This was the case with the Green Climate Fund, which was able to get pledges up to US$ 10 billion in Lima in December 2014 for its first fundraising initiative, thanks in particular to decisive commitment from the G20 Heads of State and Government.In parallel, the allocation formula, the objective of which is to reward performingcountries, has become increasingly complicated. Reality (health and food crises, climate disruption, support for endemically fragile and vulnerable regions) has introduced, over the course of various replenishment cycles, a number of a posteriori adjustments – whether to allocate funding based on exceptional circumstances (the Crisis Response Window provided by the World Bank (WB) and the Asian Development Bank (AsDB) and the Fragile States Facility operated by the African Development Bank (AfDB)) or to target priorities such as the AfDB’s regional integration projects. Since then, the stacking up of waivers and set asides has only made the allocation framework more cumbersome, rendering the whole system opaque and complex. There is a large volume of literature on this subject, demonstrating the need to take greater account of countries’ structural vulnerability in a bid to make the system intrinsically fairer and more effective. The resources allocated through the current performance-based system represent slightly more than 50% of total resources.And more than half of recipient countries – whether International Development Association (IDA) or African Development Fund (ADF) – are fragile countries. This trend will grow over the next ten years.Debt sustainability remains a constant concern. Concessional loan maturities mean that it will be particularly from 2020–2025 that the significant rise in loans granted between 2005 and 2015, as a result of the increased resources made available to concessional financing windows, will have an impact on the public finances of borrowing countries. This situation may leave countries vulnerable to external shocks, all the more so in the case of those countries which also borrowed from capital markets but on much more expensive terms – these loans will mature at the same time.The acceleration of countries completing the debt cancellation processes (Heavily Indebted Poor Countries (HIPC) and Multilateral Debt Relief Initiative (MDRI)), combined with the acceleration of global economic changes, is generating a multitude of paradoxical situations where countries currently eligible for concessional financing windows can, at the same time, gain access to capital markets. The recent revision of credit policies allowing countries eligible for concessional financing to access non-concessional funds requires a comprehensive revision of classification and graduation procedures.While the arguments in favour of maintaining concessional financing are strong – according to WB estimates, extreme poverty will still affect 504 million people in 2025, 58 percent of whom will be in Sub-Saharan Africa (80.7 percent if India, the major source of poverty outside Africa, is excluded) – it is the way in which it is mobilized and allocated that needs to be fundamentally rethought.Concessional resources should not be only considered a liquidity tool but as well as an equity one. Four main avenues of reform could be explored (the detail of these proposals is given after the summary): (i) the mobilization of concessional financing should be based on high-level political consensus; (ii) the division of effort between development institutions should be rethought in order to identify obvious comparative advantages; (iii) the country classification needs to be improved and there should be an increased focus on financing sectorial priorities; (iv) the framework for allocation resources should be adjusted to take account of these changes.The proposed reforms of the magic triangle take account of the profound economic changes countries are experiencing, and the constraints faced by development institutions. But no reform is possible without the political will to lead it. It is therefore first and foremost for capitals and for shareholders to demonstrate the courage to lead an ambitious and strategic reform agenda for the next decade.","In this paper, the authors focus on the future of concessional financing windows and propose a framework for reform based on the magic triangle, in which resource mobilization, allocation of resources and debt sustainability management are closely linked and achieve an overall balance."
"Climate Finance Short-changed: The real value of the $100 billion commitment in 2019–2020","https://scispace.com/paper/climate-finance-short-changed-the-real-value-of-the-100-1xzin4t5","2022","Report","","Tracy Carty
Jan Kowalzig","10.21201/2022.9752","","In 2009, high-income countries promised to provide $100bn a year in climate finance to low- and middle-income countries by 2020. They have failed to keep this promise. Their official reports claim that the climate finance they provided and mobilized reached $83.3bn in 2020, but Oxfam estimates the real value was only around a third of that reported. Immediate action is needed to restore trust in the $100bn goal and ensure that the provision of climate finance is fair and robust. For too long, most high-income countries have persisted in counting the wrong things in the wrong way. There are too many loans, too much debt, too few grants, too little for adaptation, and too much dishonest and misleading accounting. This paper sets out recommendations for action at COP27 and beyond to rectify these issues, restore trust in climate finance and stop the world’s poorest climate-vulnerable countries and communities being short-changed of the climate finance they urgently need, and to which they are entitled.","In 2009, high-income countries promised to provide $100bn a year in climate finance to low-and middle-income developing countries by 2020 as discussed by the authors , but Oxfam estimates the real value was only around a third of that reported."
"Towards Robust Climate Finance Accounting: Implications for the U.S. Economy","https://scispace.com/paper/towards-robust-climate-finance-accounting-implications-for-r7aigqh9a9","2024","article","Social Science Research Network","","10.2139/ssrn.4830218","","The urgent need to combat climate change has elevated climate finance accounting to a critical position in global discourse. The presented article delineates the imperative of robust climate finance accounting in addressing climate change and explores its implications for the U.S. economy. The current climate finance landscape within the United States is examined, encompassing government initiatives, private sector investments, and international commitments. An analysis of existing climate finance accounting methods and frameworks reveals their strengths, weaknesses, and notable limitations. Economic implications are discussed, elucidating the intricate interconnection between climate finance and key sectors such as renewable energy, infrastructure, and innovation. Furthermore, the environmental and social benefits resulting from effective climate finance accounting are underscored. The article places U.S. climate finance accounting in a global context, emphasizing the necessity for harmonizing accounting practices on an international scale. Challenges in current accounting practices are identified, stressing the vital role of robust accounting in informed decision-making and efficient resource allocation. The article culminates in recommendations and case studies, illustrating the transformative impact of enhanced climate finance accounting, highlighting the urgent need for a sustainable future that balances economic prosperity and environmental preservation. ","This article examines the imperative of robust climate finance accounting in addressing climate change, analyzing existing methods and frameworks, and discussing economic implications for the U.S. economy, with a focus on harmonizing international accounting practices for a sustainable future."
"Postface: fragmentation, failing trust and enduring tensions over what counts as climate finance","https://scispace.com/paper/postface-fragmentation-failing-trust-and-enduring-tensions-15fqg1896o","2017","Journal Article","International Environmental Agreements-politics Law and Economics","J. Timmons Roberts
Romain Weikmans","10.1007/S10784-016-9347-4","https://scispace.com/pdf/postface-fragmentation-failing-trust-and-enduring-tensions-15fqg1896o.pdf","The Paris Agreement commits nations in Article 2(1) to “Making finance flows consistent with a pathway towards low greenhouse gas emissions and climate-resilient development.” However there is an absence of internationally agreed accounting rules that would permit overall assessments of progress to this goal and any meaningful comparisons of performance between countries. This is true also for the quantitative Copenhagen/Cancun promise by developed nations to jointly mobilize US$100 billion by 2020. Our goal is to provoke discussion about the depth of the problems this lack of a functional definition and accounting system have created and perpetuated. We do so by describing the fragmented system of national reporting of climate finance and how the OECD’s Rio Marker system is serving neither contributors nor recipients. More than a trust issue between developed and developing countries, we argue that the lack of modalities to account for climate finance also considerably impedes the effective functioning of the bottom-up approach that now prevails under the UNFCCC. The deadline to propose ""modalities of accounting climate finance"" by 2018 is a crucial window in which to address this chronic issue in international climate policy.","In this article, the authors describe the fragmented system of national reporting of climate finance and how the OECD's Rio Marker system is serving neither contributors nor recipients, arguing that the lack of modalities to account for climate finance also considerably impedes the effective functioning of the bottom-up approach that now prevails under the UNFCCC."
"Establishing a measurement, reporting, and verification system for climate finance in post-Paris agreement period","https://scispace.com/paper/establishing-a-measurement-reporting-and-verification-system-o8op26hinq","2016","Journal Article","Chinese journal of population, resources and environment","Yinshuo Xu
Ziyuan Dong
Yao Wang","10.1080/10042857.2016.1258802","","The measurement, reporting, and verification (MRV) of climate finance was originated from discussions under the United Nations Framework Convention on Climate Change (UNFCCC). It has been one of th...","The measurement, reporting, and verification (MRV) of climate finance was originated from discussions under the United Nations Framework Convention on Climate Change (UNFCCC) and has been one of the most widely used metrics for climate finance."
"Chapter 18 Financing emission reductions: Official development assistance (ODA)-driven climate finance and beyond","https://scispace.com/paper/chapter-18-financing-emission-reductions-official-2krzhpfq","2022","Book Chapter","","Bruno Marinaro Verona","10.1515/9783110733488-018","","The Cancun Agreement of USD 100 billion is often referred to as a symbol of international cooperation on climate action and the Paris Agreement reaffirmed the stance to strengthen the global response to climate change by aligning global finance flow. Although the so-called ‘Paris alignment’ has become a new target for both the public and private sectors, little guidance is provided under the agreed international framework. Counting methods are yet to be standardised and more comprehensive and comparable data is needed to understand the broader picture of climate finance flows. Climate finance in a broad sense is a type of fund provision that targets actions to tackle climate change mitigation and adaptation, which may not necessarily meet the existing criteria of climate finance reporting largely driven by the development finance framework. The aim of this study is two-fold: 1) to identify the data gap of climate finance flows not recognised in the current system; and 2) to discuss challenges of expanding climate finance globally. ","In this article , the authors identify the data gap of climate finance flows not recognized in the current system and discuss challenges of expanding climate finance globally, which may not necessarily meet the existing criteria for climate finance reporting largely driven by the development finance framework."
"Enhancing access to concessional climate finance: perspectives from the IDB’s experience with major climate funds: CIF, GCF, and GEF","https://scispace.com/paper/enhancing-access-to-concessional-climate-finance-52z1xtj78l","2024","Journal Article","","Gloria Visconti
Gmelina Ramírez
Isabelle Braly-Cartillier","10.18235/0013047","","Meeting the climate change challenge requires the climate funds and multilateral development banks like the IDB to work synergistically, building on the comparative advantages of each. The IDB Group and other multilateral development banks are key partners, materially leveraging climate fund financing (5x leverage factor in the case of the IDB) and delivering measurable impact. To speed progress, this note presents a set of recommendations for enhancing access to the concessional finance that these funds can provide. These recommendations are mainly focused on streamlining climate funds approval processes, further developing their product offer, and enhancing their coordination and complementarity.This note was prepared by the IDB as an input to the work of the G20s Sustainable Finance Working Group on enhancing access to concessional climate finance. Stemming from the IDBs own experience working in Latin America and the Caribbean with some of the major global concessional climate funds, it intends to provide its perspectives and lessons learned on aspects affecting access to funding from the Climate Investment Funds, the Global Environment Facility and and the Green Climate Fund. ","The IDB presents recommendations to enhance access to concessional climate finance from major funds (CIF, GCF, GEF), focusing on streamlining approval processes, product development, and coordination, leveraging its experience in Latin America and the Caribbean."
"Climate Finance: Pioneering Pathways to Sustainability","https://scispace.com/paper/climate-finance-pioneering-pathways-to-sustainability-308hm2ics1we","2024","Journal Article","Economic Sciences","Mohd Irfan Pathan
Salil Seth
Lokesh Tomar
Parveen Yadav
Mrinal Kanti Mahato","10.69889/zghajm28","https://scispace.compdf/climate-finance-pioneering-pathways-to-sustainability-308hm2ics1we.pdf","Climate finance is a progressive financial tool to foster sustainability and address climate change mitigation and adaptation challenges. This study delineates the notion of climate finance and sustainability, illustrating their confluence and its impact on social welfare, ecological quality, and economic well-being. Climate financing involves distributing resources to environmentally sustainable enterprises and projects designed to harmonize economic growth with sustainability. Furthermore, developed nations have committed to offering financial assistance to developing nations to confront the problems presented by climate change. This paper aims to decode the confluence of climate finance and sustainability. Moreover, it underscores the significance of climate financing in tackling environmental issues, reaching carbon neutrality, and eventually realizing sustainable development. The finding indicates that climate finance is essential for addressing climate change and achieving sustainability, highlighting the significant role of developed nations and the private sector in closing the funding gap required for investments in climate-resilient projects and infrastructure. Consequently, this can generate possibilities for people and nations to earn carbon credits, which are tradable in carbon markets, thereby securing financial benefits. ","This study explores the confluence of climate finance and sustainability, highlighting its impact on social welfare, ecological quality, and economic well-being, and underscores the significance of climate financing in tackling environmental issues and achieving sustainable development."
