"Paper Title","Paper Link","Publication Year","Publication Type","Publication Title","Author Names","DOI","PDF Link","Abstract","TL;DR"
"The effectiveness of international climate finance in enabling low-carbon development: comparing public finance and carbon markets","https://scispace.com/paper/the-effectiveness-of-international-climate-finance-in-5dkim6jj4a","2013","Dissertation","","Martin Stadelmann","10.5167/UZH-109069","https://www.zora.uzh.ch/id/eprint/109069/1/Diss_Stadelmann.pdf","This thesis analyzes how effectively international climate finance has reduced greenhouse gas (GHG) emissions in developing and emerging countries in the last 20 years. Empirical data is used from the Clean Development Mechanism, a market-based mechanism under the Kyoto Protocol, and the Global Environment Facility (GEF), a public finance channel under the UN Framework Convention on Climate Change. In a first step, the study analyzes different interpretations of “new and additional” climate finance. Two interpretations enable an increase in climate finance without diverting development assistance: “above pre-defined projection of development assistance and climate finance” and “from new sources”. In a second step, the effectiveness in reducing GHG emissions via renewable energies is estimated. Modeling renewable energy diffusion in 120 countries, it is concluded that both CDM and GEF overestimate their influence on the diffusion of renewable energy power. In a third step, the ability of climate finance to support the adoption of renewable energy policies is examined. According to event-history models, GEF and CDM have some influence on adoption of targets and framework policies but no significant influence on feed-in tariffs and other financial incentives. In a final fourth step, project level data on the mobilization of private finance is analyzed. It is found that private finance mobilization is positively correlated with cost-effectiveness but maximizing private finance is not the most cost-effective strategy as some cost-effective projects have very low finance intensities and the public sector is a major investor in developing countries.
Diese Dissertation analysiert die Effektivitiat von internationaler Klimafinanzierung in der Reduktion von Treibhausgas(THG)-Emissionen in Entwicklungs- und Schwellenlandern. Die empirischen Daten stammen vom Clean Development Mechanism (CDM), einem Marktmechanismus unter dem Kyoto-Protokoll, und von der Global Environment Facility (GEF), einem Kanal fuer offentliche Finanzierung unter der UNO-Klimarahmenkonvention. In einem ersten Schritt werden verschiedene Interpretationen von neuer und zusatzlicher Finanzierung untersucht. Zwei davon ermoglichen eine Zunahme an Klimafinanzierung ohne Umlenkung von Entwicklungshilfe: jenseits der projizierten Klimafinanzierung und Entwicklungshilfe und aus neuen Quellen. In einem zweiten Schritt wird die Effektivitat in der Reduktion von THG-Emissionen via erneuerbare Energien analysiert. Anhand von Diffusionsmodellen wird geschlossen, dass CDM und GEF ihren Einfluss auf erneuerbare Energien tendenziell uberschatzen. In einem dritten Schritt wird die Adoption von politischen Forderinstrumenten untersucht. Laut Modelschatzungen haben GEF and CDM einen gewissen Einfluss auf die Adoption von Zielen und Rahmeninstrumenten, aber nicht auf Einspeisetariffe und andere finanzielle Forderinstrumente. In einem letzten Schritt werden Projekte anhand der Mobilisierung von privaten Finanzmitteln untersucht. Die Mobilisierung privater Finanzmittel korreliert zwar positiv mit der Effizienz in der Reduktion von THG-Emissionen, aber die Maximierung privater Finanzmittel ware nicht die effizienteste Strategie, da gewisse effiziente Projekte nur wenige Investionsmittel benotigen, und der offentliche Sektor ein wichtiger Investor in vielen Entwicklungslandern ist.","In this article, the authors analyzed how effectively international climate finance has reduced greenhouse gas (GHG) emissions in developing and emerging countries in the last 20 years using empirical data from the Clean Development Mechanism, a market-based mechanism under the Kyoto Protocol, and the Global Environment Facility (GEF), a public finance channel under the UN Framework Convention on Climate Change."
"MOvING ThE FULCRUM: A PRIMER ON PUbLIC CLIMATE FINANCING INSTRUMENTS USEd TO LEvERAGE PRIvATE CAPITAL","https://scispace.com/paper/moving-the-fulcrum-a-primer-on-public-climate-financing-2hcxwqqe0b","2012","","","Shally Venugopal","","https://scispace.com/pdf/moving-the-fulcrum-a-primer-on-public-climate-financing-2hcxwqqe0b.pdf","Targeting public finance to leverage private sector capital can help meet the several hundred billion dollars of annual low-carbon investment required in developing countries. This working paper serves as a primer, demonstrating how the public sector can employ different types of public financing instruments—whether loans, equity, or de-risking instruments—alongside policy and technical support to scale-up private sector investment in low-carbon markets.","In this article, the public sector can employ different types of public financing instruments, such as loans, equity, or de-risking instruments, along with policy and technical support to scale-up private sector investment in low-carbon markets."
"How Will the Billions of 'Free' Climate Change Allowances Under Cap-and-Trade Affect U.S. Companies’ Balance Sheets?","https://scispace.com/paper/how-will-the-billions-of-free-climate-change-allowances-2ofjdvnnw1","2010","Posted Content","Social Science Research Network","Paul A. Griffin","","https://papers.ssrn.com/sol3/Delivery.cfm/SSRN_ID1649110_code1097255.pdf?abstractid=1601122","This study examines the impact of the “free” climate change allowances under the proposed American Clean Energy and Security Act of 2009 on the balance sheets and income statements of companies in the S&P 500, estimated by the Congressional Budget Office to be as high as $700 billion over 2010-2019. Some observers contend that these allowances will generate “large windfall profits to various politically favored industries at the expense of U.S. consumers.” (Chamberlain 2009). This study states and tests an economic model that accounts for the relation between greenhouse gas emissions and financial statement variables at the individual company level to assess this contention. My analysis suggests that under the likely accounting treatments for emission allowances, U.S. companies’ balance sheet and profit ratios will show a modest but variable impact, depending on the accounting choice and industry. Some treatments, however, will allow companies to move these allowances and much of the liability “off balance sheet,” so that in these cases the financial impact of emission allowances could be unclear to many investors. When companies use diverse or unclear accounting treatments for similar economic benefits, this can raise the cost of capital and hurt share prices.","In this paper, the authors examined the impact of the ""free"" climate change allowances under the proposed American Clean Energy and Security Act of 2009 on the balance sheets and income statements of companies in the S&P 500, estimated by the Congressional Budget Office to be as high as $700 billion over 2010-2019."
"The subsidy dependence index and recent attempts to adjust it / une revue de l'indice de dépendance aux subventions et des récents essais de l'ajuster","https://scispace.com/paper/the-subsidy-dependence-index-and-recent-attempts-to-adjust-4sldpbkshh","2016","","","Mark Schreiner","","https://www.jstor.org/stable/25830703","The Subsidy Dependence Index (SDI) is the most common way to measure the importance of public support for Development Finance Institutions (DFIs). We present the SDI and show its equivalence to a subsidy-adjusted measure of return on equity We then review recent attempts to adjust the SDI. As a whole, the recent measures are either meaningless or answer unimportant questions. Their use does not lead to a better understanding of the social cost of a DFI. UNE REVUE DE L'INDICE DE DEPENDANCE AUX SUBVENTIONS ET DES RECENTS ESSAIS DE L'AJUSTER Resume Uindice de dependance aux subventions (IDS) est devenu le moyen le plus com mun de juger de I'importance du support public pour les institutions financieres de developpement. Nous derivons I'indice et montrons qu'il est equivalent a la mesure du rendement sur capitaux propres ajustee par la subvention. Nous passons en re vue ensuite les recents essais d'ajustement du IDS. Les mesures recents ne permet tent de repondre qu'a des questions pas tres importantes. Leur emploi ne meneraient pas a une connaissance meilleur du cout social des institutions financieres de deve loppement.","The Subsidy Dependence Index (SDI) as mentioned in this paper is the most common way to measure the importance of public support for Development Finance Institutions (DFIs) and shows its equivalence to a subsidy-adjusted measure of return on equity."
"Climate financing approaches and systems: an emerging country perspective","https://scispace.com/paper/climate-financing-approaches-and-systems-an-emerging-country-2mgosiolks","2009","Posted Content","Research Papers in Economics","A. Damodaran","","https://scispace.com/pdf/climate-financing-approaches-and-systems-an-emerging-country-2mgosiolks.pdf","Emerging countries like India, China and Russia who are under pressure to contribute to a mandatory mitigation regime in the forthcoming climate protocol also view the issue of financing as crucial to their future role in ensuring a low carbon pathway of growth. Whether they contribute to the process of mitigating climate change, both developing countries and emerging economies are vulnerable to global warming. The central proposition advanced in this paper is that any global climate financial architecture that recognizes the fact that mitigation and adaptation are inter-linked, the latter being conditioned by the former, has the best chance of success. The paper seeks to demonstrate that as investments on mitigation rises, risks on adaptation projects decrease, thus contributing to improved risk adjusted return from adaptation projects. With reference to coastal, water and degraded lands ecosystems in India, the paper demonstrates how higher levels of mitigation efforts reduce the capital costs of adaptation activities in developing countries. The paper also suggests that carbon markets need to be reformed through improved and varied functions that facilitate technology transfer, provide differential prices for different carbon products, facilitate enhanced access by developing country sellers and enable efficient carbon price discovery for sellers from developing world.","In this article, the authors argue that any global climate financial architecture that recognizes the fact that mitigation and adaptation are interlinked, the latter being conditioned by the former, has the best chance of success."
"The Role of National Development Banks in Intermediating International Climate Finance to Scale Up Private Sector Investments","https://scispace.com/paper/the-role-of-national-development-banks-in-intermediating-4xlfxg8ic4","2012","","","Diana Smallridge
Barbara Buchner
Chiara Trabacchi
Maria Netto
José Juan Gomes Lorenzo
Lucila Serra","","","Significant investments are needed to support the global transition to a low-carbon, climate resilient future. Current finance flows fall short of global financing needs, and massive scaling up is needed to unlock additional financial resources and foster a sustainable investment pathway. Overcoming barriers to private sector investments is critical, and international climate finance can play a catalytic role in this regard. National development banks (NDBs) have a unique role in this context, both complementing and catalyzing private sector players. NDBs have a privileged position in their local markets, strong knowledge of and long-standing relationships with the local private sector, a good understanding of local barriers to investment, and opportunities and vast experience in long-term investment financing. This paper discusses the unique role that NDBs could play in scaling up private financing for climate change mitigation projects through the intermediation of international and national public climate finance in their respective local credit markets and the conditions that would be needed for them to be most effective. It draws from experiences in international climate finance and best practices, processes, and products of NDBs within the Latin American and Caribbean region.","In this paper, the authors discuss the unique role that NDBs could play in scaling up private financing for climate change mitigation projects through the intermediation of international and national public climate finance in their respective local credit markets and the conditions that would be needed for them to most effective."
"Cuantificación de los flujos de asistencia: un nuevo enfoque","https://scispace.com/paper/cuantificacion-de-los-flujos-de-asistencia-un-nuevo-enfoque-190sv9q34b","1998","Posted Content","Research Papers in Economics","Charles Chang
Eduardo Fernández-Arias
Luis Servén","","","(Disponible en idioma ingles unicamente) La discusion sobre la eficacia de la asistencia externa se ha intensificado en los ultimos anos, en la medida en que la asistencia ha venido experimentando cada vez mas presiones presupuestarias en los paises donantes. Independientemente de los meritos de los argumentos en contra, el problema de fondo surge de si las medidas de asistencia que se emplean convencionalmente, tales como la ODA, que agrupa las donaciones y los prestamos, reflejan con precision los flujos de asistencia reales. En este trabajo se analizan las deficiencias metodologicas de las medidas convencionales de la asistencia y se propone un nuevo enfoque de valoracion que cuantifique los flujos de asistencia oficial como la suma de las donaciones y los equivalentes de donaciones de los prestamos oficiales. Esta medicion de la asistencia, conceptualmente superior, puede distanciarse considerablemente de los agregados convencionales y dar una idea muy distinta de las principales tendencias de la asistencia.","In this paper, a trabajo se analizan las deficiencias metodologicas de las medidas convencionales de la asistencia and se propone un nuevo enfoque de valoracion que cuantifique los flujos de asistencia oficial como la suma de las donaciones and los equivalentes de donación de los prestamos oficiales."
"Climate Consequences of Rebalancing Official Climate Finance: Analyzing Multilateral Development Banks’ Allocation Practices","https://scispace.com/paper/climate-consequences-of-rebalancing-official-climate-finance-fh5sc7ccxhlp","","","","Swarnodeep HomRoy
Bert Scholtens
Lina Xie","10.2139/ssrn.3986682","","The transition towards a low-carbon economy requires the fundamental reallocation of financial capital from current technologies towards green innovation. The role of public financing of green technological innovation by Multilateral Development Banks (MDB) is a largely unexplored area. In this paper, we provide novel evidence on the climate financing practices of MDBs and their long-term climate consequences. The majority of MDB climate finance is for mitigation projects and is concentrated in a small number of relatively wealthy countries. We show that MDBs’ climate financing is positively correlated with countries' greenhouse gas emissions but not with their vulnerability to climate risks. Our numerical simulations show that moving towards more equal funding of innovative mitigation-adaptation projects can substantially lower global climate vulnerability. We also show that rebalancing MDB funding towards adaptation projects and technologies can reduce vulnerability significantly for an additional 2.5 billion people, without a significant change in the annualized growth rate of emissions.","This study examines Multilateral Development Banks' climate financing practices, finding a positive correlation between funding and greenhouse gas emissions, but not climate vulnerability. Rebalancing funding towards adaptation projects can significantly reduce global climate vulnerability."
"Climate Finance","https://scispace.com/paper/climate-finance-ciz0u6r5bq2n","2025","Journal Article","","Ananya Pandey
Jipson Joseph","10.4018/979-8-3373-5198-8.ch002","","With emerging trends in industrialization, the globe is facing a rise in greenhouse gas emissions leading to extreme change in climatic conditions. Several connected issues such as melting of glaciers and increase in the level of greenhouse gas emissions are affecting the environment sustainability. The mitigation and adaptation of change in climatic conditions have become the need of the hour. Climate finance is the solution to these problems. Global climate finance in 2021–2022 was approximately $1.3 trillion annually. But much more is required to limit global temperature increases to 1.5°C. The challenge of fulfilling global climate financing needed to enable adaptation plans and lower carbon emissions to sustainable levels is one of the significant discussions in the multilateral arena. In this perspective, the chapter analyzes the current actions and movements related to climate finance. The exploration of international, regional, and national instruments of climate finance have been significantly highlighted. ","Climate finance is crucial to mitigate and adapt to climate change, with global climate finance reaching $1.3 trillion annually in 2021-2022, but more is needed to limit global temperature increases to 1.5°C and achieve sustainable levels."
"Climate Finance at a Glance","https://scispace.com/paper/climate-finance-at-a-glance-2ghvhhxb9v","2021","Book Chapter","","Farid Mohamadi","10.1007/978-3-030-68740-3_16","","Most of the world’s countries have ratified the Paris Agreement in 2015, and embraced the global movement of fight against climate change. Renewable Energy Infrastructure is one of the most relevant mitigation measures to achieve the committed goals, this is because energy counts for around three quarters of the global greenhouse emissions (GHE), the largest GHE emission contributor among all sectors. Although the taxonomy is not clearly defined in all jurisdictions, Climate Finance encompasses financing forms used to fund renewable energy infrastructure. But Climate Finance is a complex notion. It refers to public and private funds dedicated to financing activities that reduce the impact on our environment. Typically, the players, beside the largest one, the private sector, active in the financing of renewable energy are funds such as the Clean Technology Fund or Green Climate Fund, as well as the Development Financial Institutions (DFIs) such as the World Bank Group, IFC, AsDB or AfDB. They offer guarantees, soft loans, as well as grants and similar incentives. Being introduced to the different options offered by those funds and multilateral banks and to their role in RE finance allows a better understanding of the “jungle” of the climate finance structure.","In this paper, the authors introduce the different options offered by those funds and multilateral banks and to their role in renewable energy finance, and introduce a better understanding of the ""jungle"" of the climate finance structure."
"The alignment of global equity and corporate bonds markets with the Paris Agreement: A new accounting framework","https://scispace.com/paper/the-alignment-of-global-equity-and-corporate-bonds-markets-1m16rw637d","2019","Journal Article","Journal of Applied Accounting Research","Jakob Thomä
Michael Hayne
Nikolaus Hagedorn
Clare Murray
Rebecca Grattage","10.1108/JAAR-03-2018-0034","","To comply with the adopted Paris Agreement, global finance flows must be measured against climate scenarios consistent with possible pathways towards limiting global warming to 2°C or less. For this, there must be proven and accepted accounting principles for assessing financial plans of climate relevant actors against climate models. As there are a variety of data sources describing the financial plans of relevant actors, these principles must accommodate a variety of reported information, while still yielding relevant metrics to different stakeholders. The paper aims to discuss these issues.,A set of accounting principles tested by governments, financial supervisory bodies and both institutional investors and mangers, covering global-listed equity and corporate bond investment is described.,The application illustrates that a common set of accounting principles can act across both asset classes and provide relevant metrics to multiple stakeholders.,The principles require data of varying quality and are ultimately unverified. Thus, the definitive quality of the output metrics is uncertain and is yet to be characterized. The principles are yet to be applied to the credit market as the information is seldom publicly available, but it too plays an important role in the required market transition and therefore must be incorporated into these guiding principles of analysis.,The principles allow for standardised assessment of financial flows of equity and corporate debt with global climate scenarios.,It illustrates the acceptance of a common set of accounting principles that is relevant across different actors and asset classes and summarizes the principles underlying the first climate finance scenario analyses.","In this paper, a set of accounting principles tested by governments, financial supervisory bodies and both institutional investors and mangers, covering global-listed equity and corporate bond investment is described."
"Addressing the barriers to climate investment CDKN GUIDE","https://scispace.com/paper/addressing-the-barriers-to-climate-investment-cdkn-guide-2oy9v4ps8p","2013","","","Johannes Berliner
Christine Grüning
Karol Kempa
Carola Menzel
Ulf Moslener","","","About this guide ● CDKN aims to help decisionmakers select and deploy financial instruments (such as grants, concessional loans, equity and guarantees) to fund climate adaptation and mitigation activities. ● This guide summarises the barriers to financing mitigation and adaptation activities, as well as discussing factors to consider when selecting and implementing financial instruments. ● The key financial instruments and modalities considered in this guide are discussed in relation to the Green Climate Fund, but the lessons are applicable to other channels for climate finance.","In this paper, the authors discuss the barriers to financing mitigation and adaptation activities, as well as discuss factors to consider when selecting and implementing financial instruments, such as grants, concessional loans, equity and guarantees."
"The international climate finance accounting muddle: is there hope on the horizon?","https://scispace.com/paper/the-international-climate-finance-accounting-muddle-is-there-rux7bmcki6","2019","Journal Article","Climate and Development","Romain Weikmans
J. Timmons Roberts","10.1080/17565529.2017.1410087","https://www.tandfonline.com/doi/pdf/10.1080/17565529.2017.1410087","The sources and governance of climate finance have been widely debated since the 2009 climate change summit in Copenhagen, when rich countries promised to provide US$ 30 billion in additional clima...","The sources and governance of climate finance have been widely debated since the 2009 climate change summit in Copenhagen, when rich countries promised to provide US$ 30 billion in additional clima... as discussed by the authors."
"The future of climate finance: balancing ownership and accountability","https://scispace.com/paper/the-future-of-climate-finance-balancing-ownership-and-c5t4v9pt","2022","Book Chapter","","","10.4337/9781784715656.00025","","International market-based cooperation was conceptualized under the Kyoto Protocol to deliver (carbon) finance for mitigation outcomes (e.g., emissions credits), which buyers can use for their own purposes. In contrast, climate finance providers do not 'claim' any generated mitigation outcomes for their own achievement of mitigation target and there is no transfer of mitigation outcomes. The same mitigation outcome cannot be accounted as both carbon and climate finance. However, baseline and credit mechanisms, so far mostly used for carbon finance, can be tools for mobilizing climate finance and enhancing its effectiveness in delivering real, additional, and verified mitigation outcomes. Here, two main ways exist. First, crediting mechanisms can be used for delivering public and private results-based climate finance as long as the credits are not used by the buyers for compliance with mandatory or voluntary emissions targets. Second, carbon and climate finance sources may be blended to boost finance for mitigation. Market-based cooperation under Article 6 of the Paris Agreement contributes to financing conditional NDC targets. If multiple sources of finance are blended and investors want to claim climate finance provided, attribution of mitigation to financing sources becomes key. ","In this article , the same mitigation outcome cannot be accounted as both carbon and climate finance, and crediting mechanisms can be used for public and private results-based climate finance as long as the credits are not used by the buyers for compliance with mandatory or voluntary emissions targets."
