"Paper Title","Paper Link","Publication Year","Publication Type","Publication Title","Author Names","DOI","PDF Link","Abstract","TL;DR"
"Climate Finance at COP21 and After: Lessons Learnt","https://scispace.com/paper/climate-finance-at-cop21-and-after-lessons-learnt-1icyoxcch7","2016","Posted Content","Research Papers in Economics","Etienne Espagne","","","Summary Finance has emerged in the last few years in and outside the Conference of the Parties (COP) process as a key ingredient of climate policy design. It also appears to be a key sector for structural reform in order to align it with the new low-carbon horizon. This policy brief draws lessons from a discussion platform launched jointly by CEPII and France Strategie, which welcomed more than thirty contributions on climate finance issues from various experts and citizens in the four months leading to COP21. Both these contributions and the final text adopted by the Parties indicate that the financial question will remain essential in the near future in order to consolidate and nurture the Paris Agreement. In this brief, three directions for future debates are analyzed. First, the equity question remains open, through the financing schemes to guarantee a minimum of $100 billion in annual transfers to developing countries in the name of the principle of “common but differentiated responsibilities”. The question of an increasing ambition to implement the “Intended Nationally Determined Contributions” through specific financial instruments is also discussed. Finally, the necessary long-term objective of a net decarbonization of the world economy invites us to look for more structural reforms in the financial sector.","In this article, the authors draw lessons from a discussion platform launched jointly by CEPII and France Strategie, which welcomed more than thirty contributions on climate finance issues from various experts and citizens in the four months leading to COP21."
"How Do Donors Integrate Climate Policy and Development Cooperation? an Analysis of the Development Aid Policies of 42 Donor Countries","https://scispace.com/paper/how-do-donors-integrate-climate-policy-and-development-9cubybgonizj","","","","Ida Dokk Smith
Kristine Schi Nordvold
Indra Overland
Tinatin Osmonova","10.1080/14693062.2024.2390522","","This article assesses how donor countries integrate climate action into their development aid policies. An analytical framework is developed for the systematic comparison of development aid policies along three dimensions: hierarchy of policy objectives, types of measures the donors implement, and linkages to international climate negotiations. Analyzing the development aid policies of 42 donors, we find that only three have redesigned their development aid policies to fully integrate climate policy concerns. Instead, donors treat climate change as a thematic priority area. This includes several donors that are currently not obliged to provide climate finance under the UNFCCC. Furthermore, five major donor countries emphasize the use of diverse foreign policy tools to support climate action in developing countries. Importantly, we identify how other development goals (poverty, gender) are integrated with climate policy goals. Only two donor countries clearly separate development aid and climate finance. Luxembourg states that its climate finance pledge is additional to development, while New Zealand has a separate climate finance strategy where the allocation of funds is based on climate mitigation effectiveness concerns. Climate finance channelled through development aid programs is treated as a thematic priority area and mostly steered by existing development aid priorities and partnerships rather than requirements for effective climate policy.Despite more than 15 years of debate on new and additional climate finance, donors still do not spell out the principle of additionality in their policy documents. This applies both to Annex II and non-Annex II donor countries.Two donors have published separate climate finance strategies but for different purposes: New Zealand to separate between development and climate policy goals and Ireland to ensure alignment between its development goals and climate finance pledges.Few donors differentiate between climate adaptation and mitigation as two different cross-cutting issues with different trade-offs and synergies.Aid donor policies and instruments to leverage private capital are more advanced for climate mitigation than for adaptation.","This study analyzes the integration of climate policy into development aid policies of 42 donor countries, finding that only three fully integrate climate concerns, while others treat it as a thematic priority area, often lacking clear additionality principles and differentiation between adaptation and mitigation."
"Equity and Justice in Loss and Damage Finance: A Narrative Review of Catalysts and Obstacles","https://scispace.com/paper/equity-and-justice-in-loss-and-damage-finance-a-narrative-14ku6f4mzg","2024","Journal Article","Current climate change reports","Ike Uri
Stacy-ann Robinson
J. T. Roberts
David Ciplet
Romain Weikmans
Mizan Khan","10.1007/s40641-024-00196-6","","Abstract Purpose of Review Recent focus on loss and damage within the United Nations Framework Convention on Climate Change (UNFCCC) follows decades of demands by vulnerable countries for compensation for losses due to climate change. Reviewing recent literature on loss and damage finance, we consider how the new UNFCCC Loss and Damage Fund could be transformative for climate finance. Recent Findings This article reviews developments within the UNFCCC, including the creation of the new Loss and Damage Fund and changes in the broader field of climate finance. Recent literature indicates that the factors necessary for just loss and damage finance include inclusive governance, new and additional funds, purpose-made instruments and channels, direct access to funds, and burden sharing aligned with the polluter pays principle. Summary We overview the history of loss and damage finance, suggest five criteria that could make the Loss and Damage Fund just, and discuss four potential catalysts for just loss and damage finance: ecological and climatic impacts, institutional developments outside the UNFCCC, Global South leadership on debt justice, and legal developments. As the Loss and Damage Fund is operationalized and the need for loss and damage finance grows, scholars must continue to ask whether loss and damage finance furthers core tenets of climate justice, including forms of restitution. ","This narrative review examines the UNFCCC's Loss and Damage Fund, identifying catalysts and obstacles for just loss and damage finance, including inclusive governance, new funds, and burden sharing aligned with the polluter pays principle."
"How much finance is in climate finance? A bibliometric review, critiques, and future research directions","https://scispace.com/paper/how-much-finance-is-in-climate-finance-a-bibliometric-review-2nb246kx","2023","Journal Article","Research in International Business and Finance","Rosella Carè
Olaf Weber","10.1016/j.ribaf.2023.101886","","","In this paper , the research hotspots and evolution trends in climate finance research are described and analyzed, and the research gaps within the existing climate finance literature are identified, and 35 research questions for future research are proposed."
"Systematic literature review and bibliometric analysis of green finance and renewable energy development","https://scispace.com/paper/systematic-literature-review-and-bibliometric-analysis-of-5c0afmbstm","2024","Journal Article","Sustainable Development","Siti Nurain Muhmad
Sadia Cheema
Akmalia Mohamad Ariff
Nik Fadhilah Nik Him
Siti Nasuha Muhmad","10.1002/sd.3093","","Abstract Climate change poses a significant threat to ecosystems, the economy, human health, and livelihoods worldwide. Hence, it is imperative to establish international collaboration among governments and corporations to effectively address climate change through the reduction of emissions and preservation of the environment. This study aims to examine and deliberate on publications on green finance initiatives and renewable energy development. This study conducts a systematic literature review and a meticulous bibliometric analysis that examines 128 scientific papers from 2010 to 2023 on green finance and renewable energy development to address the urgent need for sustainable solutions in the fight against climate change. The analysis shows a significant increase in annual publications, revealing growth in global interest in green finance and renewable energy with high‐impact journals playing a vital role in publishing research outputs. Furthermore, China is the country with the most publications, holding a commanding position. Another finding from the analysis is that from an academic perspective, the United States is also a country that is heavily engaged in research on green finance and renewable energy development. The study confirms the positive relationship between green finance and renewable energy development, and it shows that there is an urgent need to have green finance initiatives in companies to accelerate the development of renewable energy. The findings emphasize the importance of further research and global collaborations to harness the potential of green finance for a sustainable, low‐carbon future. ","Systematic literature review and bibliometric analysis of green finance and renewable energy development reveals a significant increase in annual publications, highlighting the growing global interest in sustainable solutions."
"State-of-the-art literature review on green finance with tabular-graphical and network analyses","https://scispace.com/paper/state-of-the-art-literature-review-on-green-finance-with-49c7rteoiu","2023","Journal Article","Journal of turkish operations management","Elif Haktanır
Cengiz Kahraman","10.56554/jtom.1362603","","Green finance is a method of financing that supports investments with a positive impact on the environment, such as the acquisition of eco-friendly goods and services as part of sustainable development or the building of eco-friendly infrastructure. Green finance has started to occupy a very important place in the literature in recent years due to the increasing sensitivity towards the environment. In this literature review, the relations of green finance with fields such as green economy, sustainable development, environmental protection, green manufacturing, and risk assessment have been examined in all aspects with the help of tables and figures. In addition, a bibliometric analysis of green finance studies’ authors, publication sources, institutions, countries, subject areas, document types, and funding sponsors is presented with graphical analyses. The most widely publishing journals in the field of green finance, the most cited studies, conferences in this field, and books published on green finance are presented in tables. Instruments and components of green finance are also reviewed in detail by graphical illustrations. ","Green finance literature review with tabular-graphical and network analyses. The review examines the relations of green finance with other fields and presents a bibliometric analysis of green finance studies."
"Bibliometric Analysis of Scopus-Indexed Climate Finance Studies","https://scispace.com/paper/bibliometric-analysis-of-scopus-indexed-climate-finance-2ib33b94rs","2024","Journal Article","","Aam Slamet Rusydiana","10.58968/tae.v1i1.451","","Climate finance refers to the study of local and global financing of public and private investments aimed at supporting climate change mitigation and its impacts. This research aims to find out the extent of the development of Climate finance themed research in the world. The results of the study show that the number of research publications related to this topic is 1051 Scopus indexed journal articles. Furthermore, based on the results of the analysis on bibliometric author mapping, it shows that Chirambo D.; Mohan P.S.; Richardson B.J.; Gunningham N.; Bracking S.; Setyowati A.B.; D'orazio P.; Popoyan L.; and Michaelowa A are the authors who have the most publications on the theme of climate finance. Finally, in the development of research related to climate finance based on bibliometric keyword mapping, it is divided into 5 clusters, namely: (1)Economic Effects of Climate Finance Transition, (2)Governance Principles for Green Climate Fund Projects; (3)Implementation of Climate Finance, (4)Climate Change Financing Issues, and (5)Government Role in City Climate Finance Opportunities.","The research on climate finance has grown significantly, with 1051 Scopus-indexed journal articles. The authors with the most publications are Chirambo D.; Mohan P.S.; Richardson B.J.; Gunningham N.; Bracking S.; Setyowati A.B.; D'orazio P.; Popoyan L.; and Michaelowa A. The research is divided into 5 clusters based on bibliometric keyword mapping."
"Bibliometric foundations: tracking the footprint of green finance and financial institutions in global research","https://scispace.com/paper/bibliometric-foundations-tracking-the-footprint-of-green-3sv268thb6","2024","Journal Article","Journal of Business and Management Review","Winny Astiwardhani","10.47153/jbmr412.8702023","","This study evaluates research trends in the context of green finance relating to financial institutions, particularly banks, using bibliometric analysis of Scopus data between 2012 and 2023. Green finance, as a key focus, has evolved along with the increasing awareness of environmental issues and climate change. Chinese contributions dominate in this study, showing a strong interest and commitment to green finance. This bibliometric analysis presents a network of related keywords, highlighting terms such as green finance, sustainable development, China, renewable energy, and others. Increased research interest in green finance has been seen since 2020, reflecting the growing attention to green finance, especially in China. From the citation analysis, there are highly cited papers that cover important issues, including the role of banks in green finance innovation, its impact on environmental change, and the implementation of greener financial practices. Cluster analysis shows three main groups: green finance concepts and principles, implementation of green finance practices, and long-term implications of green finance on the environment. These clusters illustrate the conceptual foundations, implementation practices, and long-term impacts of green finance in the context of banking and financial institutions. ","Bibliometric analysis of green finance research on financial institutions reveals increasing research interest and Chinese dominance. The study identifies key keywords and clusters related to green finance and banking, highlighting the importance of green finance in addressing environmental issues and its growing impact on the banking sector."
"Climate finance policy in practice: a review of the evidence","https://scispace.com/paper/climate-finance-policy-in-practice-a-review-of-the-evidence-2whu2lt7eq","2021","Journal Article","Climate Policy","Rishikesh Ram Bhandary
Kelly Sims Gallagher
Fang Zhang","10.1080/14693062.2020.1871313","","","The authors empirically evaluates how policy to mobilize climate finance works in practice and examines the performance of nine types of climate finance policies, namely target lending, green bond, and green bond p..."
"The Nature of Global Green Finance Standards—Evolution, Differences, and Three Models","https://scispace.com/paper/the-nature-of-global-green-finance-standards-evolution-rjze3yqfx5","2021","Journal Article","Sustainability","Christoph Nedopil
Truzaar Dordi
Olaf Weber","10.3390/SU13073723","","(1) Background: Green finance standards have proliferated with much need for harmonization to accelerate global green financial flows However, little is known on the nature of green finance standards that accelerates differentiation, rather than harmonization Therefore, we embark to answer the question what the nature of green finance standards is and specifically how green finance standards have evolved in major economic systems driven by different actors and leading to differences and commonalities over time and environmental focus area (2) Methods: To analyze the question, we build a model based on institutional and standards theory and apply text analysis and statistical methods to analyze 84 green finance standards issued from 1998 to 2020 (3) Results: we find clear evidence that green finance standards evolve depending on economic governance types (eg, market-based, government-based and in weak institutional environments), environmental focus areas (eg, pollution, climate, biodiversity) and depend on actors in government, intermediaries and developing financial institutions We also show that this development has been dynamic over the last few decades We further test and confirm three models of green finance standards: output-based, input-based and process standards that have evolved With the findings, we aim to provide a better foundation for both research and policy in future green finance standard research, development and harmonization","In this article, a model based on institutional and standards theory and applying text analysis and statistical methods to analyze 84 green finance standards issued from 1998 to 2020 is proposed to answer the question what the nature of green finance standard is and specifically how green finance norms have evolved in major economic systems driven by different actors."
"A Bibliometric Analysis of Green Finance","https://scispace.com/paper/a-bibliometric-analysis-of-green-finance-4n2prp9hzo","2023","Book Chapter","Advances in finance, accounting, and economics book series","Renuka Sharma
Kiran Mehta
Sudha Ahuja","10.4018/978-1-6684-8624-5.ch009","","Sustainable finance is one of the most cutting-edge growth trends in the financial sector, thanks to its growing worldwide significance. Climate finance/green finance/carbon finance has developed in recent years as a potential tool for tackling climate change and its environmental implications while also funding adaptation. Green financing, a novel kind of financial support, aims to support green development while simultaneously reducing carbon emissions. It's an emerging concept that is often explored in the context of preparing for and reducing climate-related environmental degradation. The present study aims to give a detailed review of existing knowledge on the subject of green finance. This chapter used bibliometric methods to analyse 349 articles related to sustainable finance published between 2000 and 2022. The study examined the number of publications, nations, journals, keywords, topic areas, and organisations, as well as highly cited individuals and articles. The study also aims to effectively communicate its findings by using visual depictions and network analysis. ","A bibliometric analysis of green finance literature reveals a growing trend in sustainable finance with a focus on climate change and environmental degradation."
"A Scoping Review of Barriers to Investment in Climate Change Solutions","https://scispace.com/paper/a-scoping-review-of-barriers-to-investment-in-climate-change-39n9rbyf73","2019","Journal Article","Sustainability","Sarah Hafner
Olivia James
Aled Jones","10.3390/SU11113201","","The finance sector has engaged with policy development processes associated with climate solutions for well over a decade, with the aim of overcoming barriers to investment. In this paper we analyse 31 practice-based policy reports which highlight key barriers to such investing. We use those practice-based policy reports to identify themes associated with barriers to investment to conduct a scoping literature review of academic research. We identify 91 relevant papers and use content analysis to summarise the barriers identified in a structured way to help inform the research landscape in a timely manner. Given the urgency of this issue, we call on the academic community to focus more effort in this new and emerging discipline and, in particular, on the need for an independent view on the validity of some of the claims made in these practice-based policy reports.","In this article, the authors analyse 31 practice-based policy reports which highlight key barriers to investment in climate solutions, and identify 91 relevant papers and use content analysis to summarise the barriers identified in a structured way to help inform the research landscape."
"The emergence of green finance a conceptual framework for environmental sustainability: innovation viewpoint","https://scispace.com/paper/the-emergence-of-green-finance-a-conceptual-framework-for-28th40v8cfi4","2024","Journal Article","F1000Research","Farman Ali
Anu Sayal
Pradeep Suri
Vasim Ahmad
Sanjay Singh Chauhan
Diksha Panwar","10.12688/f1000research.157894.1","","<ns3:p>Background of the study This study intends to contribute to the continuing discussion about green economic growth by objectively investigating the consequences of clean energy generation, cutting-edge green practices, and ethical business on global sustainability. This study also examines how green finance laws effectively handle the financial limitations that companies face when pursuing green innovation. Green finance enables the development and implementation of sustainable business models, investments, trade, economic, environmental, and social projects through the effective utilization of financial resources. Methods This article offers a complete evaluation of the current state and advancements in green finance research using a mixed-methods approach, which includes bibliometric and qualitative analysis. We analysed a big dataset of research papers after entering the keywords into the Scopus database. Results This study found that green bank products include green securities, investments, climate financing, carbon finance, insurance, credit, and infrastructure bonds. Sustainability, sustainable development, investments, environmental economics, sustainable finance, green bonds, and the green economy dominate as a most prevalent theme. China has the strongest bibliometric linkages to other nations, followed by the US and UK. This study also examines whether green finance policies address firm financial restrictions while pursuing green innovation. VOS-viewer generates co-authorship-based keyword occurrence links and network maps. Conclusion Green finance strives to increase funding flows to sustainable development goals while mitigating environmental and social hazards. “Going green,” pricing, forecasting, modelling, picking the most efficient tool, and influencing investor behaviour toward environmentally friendly operations are all challenges. Environmental policies, interest rates, religion, risks, social inclusion, and banking laws all have an impact on bank green financing initiatives. The study’s main contribution is an overview of green finance breakthroughs for sustainability, which may help scholars and practitioners understand the trend and future research directions.</ns3:p> ","This study examines the emergence of green finance as a conceptual framework for environmental sustainability, analyzing its impact on global sustainability, financial limitations, and green innovation, and identifies key themes, challenges, and future research directions."
"An Overview on Climate Change, Environment, and Innovative Finance in Emerging and Developing Economies","https://scispace.com/paper/an-overview-on-climate-change-environment-and-innovative-1jq3gxzo","2022","Report","","Sayuri Shirai","10.56506/drtf8552","","The global economy has been facing a series of adverse shocks in recent years including the COVID-19 pandemic, climate crisis, the Russian invasion of Ukraine, high inflation, and interest rate shocks driven by global monetary policy normalization. The high cost of fossil fuels since 2021, moreover, has reminded the world that investment for clean energy projects has been severely inadequate due to limited implementation of climate policies and limited capital inflows to financing decarbonization efforts. While overdependence on fossil fuels might be inevitable currently, the world needs to accelerate transition to carbon neutrality and also begin to cope with nature capital stock and biodiversity losses, which are happening at an alarming pace. In particular, more financial support should be provided to emerging and developing economies (EMDEs) to help achieve climate and environmental goals and other sustainable development goals (SDGs). We give an overview of some innovative finance schemes applicable to EMDEs, including blended finance to mobilize more private capital to climate and environmental projects and debt-for-climate swaps (or debt-for-nature swaps), to provide de facto grants to small high-debt economies in exchange for climate projects (or nature protection). We also provide some suggestions for further actions through better coordination among donor and recipient nations led by G7 and G20 nations.","In this article , the authors give an overview of some innovative finance schemes applicable to emerging and developing economies (EMDEs) to help achieve climate and environmental goals and other sustainable development goals (SDGs)."
