"Paper Title","Paper Link","Publication Year","Publication Type","Publication Title","Author Names","DOI","PDF Link","Snippet","Abstract"
"Towards Robust Climate Finance Accounting: Implications for the Us Economy","https://scispace.com/paper/towards-robust-climate-finance-accounting-implications-for-r7aigqh9a9","2024","article","Social Science Research Network","E Adeboye
V Ekere
G Labisi","10.2139/ssrn.4830218","https://papers.ssrn.com/sol3/Delivery.cfm?abstractid=4830218","… RECOMMENDATIONS This section contains some of the evidence-based recommendations in order to advance climate finance accounting standards in the United States and harness …","The urgent need to combat climate change has elevated climate finance accounting to a critical position in global discourse. The presented article delineates the imperative of robust climate finance accounting in addressing climate change and explores its implications for the U.S. economy. The current climate finance landscape within the United States is examined, encompassing government initiatives, private sector investments, and international commitments. An analysis of existing climate finance accounting methods and frameworks reveals their strengths, weaknesses, and notable limitations. Economic implications are discussed, elucidating the intricate interconnection between climate finance and key sectors such as renewable energy, infrastructure, and innovation. Furthermore, the environmental and social benefits resulting from effective climate finance accounting are underscored. The article places U.S. climate finance accounting in a global context, emphasizing the necessity for harmonizing accounting practices on an international scale. Challenges in current accounting practices are identified, stressing the vital role of robust accounting in informed decision-making and efficient resource allocation. The article culminates in recommendations and case studies, illustrating the transformative impact of enhanced climate finance accounting, highlighting the urgent need for a sustainable future that balances economic prosperity and environmental preservation. "
"The role of carbon market mechanisms in climate finance","https://scispace.com/paper/the-role-of-carbon-market-mechanisms-in-climate-finance-2kyl6chu","2022","Book Chapter","","A Espelage
HM Ahonen","10.4337/9781784715656.00023","","… by robust accounting that ensures avoidance of double-counting of the underlying finance (as both carbon and climate finance), as well as double-counting of the underlying mitigation …","This chapter looks at enhanced direct Access (EDA), an innovative programmatic access modality for multilateral climate funds under which funding decisions are delegated to the recipient national or sub-national level. It begins by looking at historic precursors, such as the Marshall Plan in Germany, and then turns to discuss the evolution of EDA in international climate finance, and ends with conclusions on the way forward. "
"CLIMATE FINANCE SHADOW REPORT 2023","https://scispace.com/paper/climate-finance-shadow-report-2023-69vbsrwketx9","2024","Journal Article","Climate Change and Law Collection","F SHADOW","10.1163/9789004322714_cclc_2023-0060-0340","https://www.oxfam.org.tw/tc/f/news_and_publication/96599/172506/bp-climate-finance-shadow-report-050623.pdf","… in climate finance by 2020 has been missed.Based on the current accounting and reporting practices applied by climate finance contributors, total climate finance … TRANSPARENCY IN …",""